2022-2023;ORLEANS-TOURS;037;INDRE-ET-LOIRE;0370009J;LYCEE POLYVALENT FRANCOIS RABELAIS;37072;CHINON;public;LPO;1157.0;97.0;1254.0;112.3;97.5;111.1;31.0;24.8
2022-2023;ORLEANS-TOURS;037;INDRE-ET-LOIRE;0370039S;LYCEE GENERAL ET TECHNOLOGIQUE PAUL LOUIS COURIER;37261;TOURS;public;LEGT;858.0;;858.0;119.0;;119.0;36.9;
2022-2023;ORLEANS-TOURS;037;INDRE-ET-LOIRE;0370749N;LYCEE GENERAL ET TECHNOLOGIQUE PRIVE SAINTE MARGUERITE;37050;CHAMBRAY LES TOURS;privé sous contrat;LEGT;228.0;;228.0;132.6;;132.6;29.3;
2022-2023;ORLEANS-TOURS;037;INDRE-ET-LOIRE;0370757X;LYCEE PROFESSIONNEL PRIVE NOTRE DAME LA RICHE SOUS LE PATRONAGE DE SAINT VINCENT DE PAUL;37261;TOURS;privé sous contrat;LP;;441.0;441.0;;109.4;109.4;;27.7
2022-2023;ORLEANS-TOURS;037;INDRE-ET-LOIRE;0371100V;LYCEE PROFESSIONNEL JOSEPH CUGNOT LYCEE DES METIERS DE L INDUSTRIE ET DES SERVICES;37072;CHINON;public;LP;;298.0;298.0;;87.4;87.4;;25.0
2022-2023;ORLEANS-TOURS;037;INDRE-ET-LOIRE;0371328T;LYCEE PROFESSIONNEL PRIVE SAINTE URSULE;37261;TOURS;privé sous contrat;LP;;99.0;99.0;;104.9;104.9;;30.0
2022-2023;ORLEANS-TOURS;037;INDRE-ET-LOIRE;0371418R;LYCEE GENERAL ET TECHNOLOGIQUE JACQUES DE VAUCANSON;37261;TOURS;public;LEGT;1077.0;;1077.0;123.4;;123.4;33.3;
2022-2023;GRENOBLE;038;ISERE;0380008C;LYCEE GENERAL ET TECHNOLOGIQUE L OISELET;38053;BOURGOIN JALLIEU;public;LEGT;1777.0;;1777.0;112.4;;112.4;35.4;
2022-2023;GRENOBLE;038;ISERE;0380018N;LYCEE TECHNOLOGIQUE PRIVE ISER LYCEE DES METIERS DU COMMERCE DU SOCIAL ET DES SERVICES A LA PERSONNE;38185;GRENOBLE;privé sous contrat;LEGT;37.0;;37.0;113.6;;113.6;31.1;
2022-2023;GRENOBLE;038;ISERE;0380023U;LYCEE PROFESSIONNEL JACQUES PREVERT;38169;FONTAINE;public;LP;;358.0;358.0;;89.6;89.6;;29.2
2022-2023;GRENOBLE;038;ISERE;0380027Y;LYCEE GENERAL CHAMPOLLION;38185;GRENOBLE;public;LEGT;865.0;;865.0;139.4;;139.4;34.7;
2022-2023;GRENOBLE;038;ISERE;0380032D;LYCEE POLYVALENT EMMANUEL MOUNIER;38185;GRENOBLE;public;LPO;637.0;414.0;1051.0;93.1;84.4;89.7;35.3;27.7
2022-2023;GRENOBLE;038;ISERE;0380049X;LYCEE POLYVALENT DE LA MATHEYSINE;38269;LA MURE;public;LPO;334.0;134.0;468.0;118.6;92.2;111.0;35.3;24.9
2022-2023;GRENOBLE;038;ISERE;0380081G;LYCEE POLYVALENT ELLA FITZGERALD;38544;VIENNE;public;LPO;1458.0;305.0;1763.0;113.9;89.2;109.7;34.5;28.0
2022-2023;GRENOBLE;038;ISERE;0380089R;LYCEE POLYVALENT PORTES DE L OISANS LYCEE DES METIERS DE L ELECTRONIQUE ET DU NUMERIQUE;38562;VIZILLE;public;LPO;883.0;316.0;1199.0;122.3;98.0;115.9;34.2;29.5
2022-2023;GRENOBLE;038;ISERE;0380092U;LYCEE POLYVALENT FERDINAND BUISSON;38563;VOIRON;public;LPO;1006.0;346.0;1352.0;130.5;101.2;123.0;34.3;31.0
2022-2023;GRENOBLE;038;ISERE;0380097Z;LYCEE CLIMATIQUE JEAN PREVOST;38548;VILLARD DE LANS;public;LEGT;413.0;;413.0;136.4;;136.4;33.0;
2022-2023;GRENOBLE;038;ISERE;0381741L;LYCEE PROFESSIONNEL PRIVE LE BREDA LYCEE DES METIERS DU COMMERCE DU SOCIAL ET DES SERVICES A LA PERSONNE;38006;ALLEVARD;privé sous contrat;LP;;92.0;92.0;;106.7;106.7;;26.6
2022-2023;GRENOBLE;038;ISERE;0381805F;LYCEE PROFESSIONNEL PRIVE LES PORTES DE CHARTREUSE;38565;VOREPPE;privé sous contrat;LP;;392.0;392.0;;115.1;115.1;;29.3
2022-2023;GRENOBLE;038;ISERE;0382203N;LYCEE POLYVALENT PABLO NERUDA LYCEE DES METIERS DE L ELECTRICITE ET DE SES ENVIRONNEMENTS CONNECTES;38421;SAINT MARTIN D HERES;public;LPO;912.0;187.0;1099.0;120.3;89.7;115.1;39.1;30.3
2022-2023;GRENOBLE;038;ISERE;0382863F;LYCEE POLYVALENT DU GRESIVAUDAN;38229;MEYLAN;public;LPO;1204.0;33.0;1237.0;144.0;111.6;143.1;32.4;28.4
2022-2023;GRENOBLE;038;ISERE;0382893N;LYCEE PROFESSIONNEL PRIVE JEAN MARIE VIANNEY;38130;LA COTE SAINT ANDRE;privé sous contrat;LP;;31.0;31.0;;103.6;103.6;;28.3
2022-2023;GRENOBLE;038;ISERE;0383072H;LYCEE POLYVALENT PRIVE SAINT MARC;38276;NIVOLAS VERMELLE;privé sous contrat;LPO;1257.0;120.0;1377.0;132.6;111.9;130.8;26.1;26.9
2022-2023;GRENOBLE;038;ISERE;0383208F;LYCEE POLYVALENT PRIVE PHILIPPINE DUCHESNE;38516;LA TRONCHE;privé sous contrat;LPO;790.0;163.0;953.0;138.8;117.4;135.2;25.9;28.8
2022-2023;BESANCON;039;JURA;0390029V;LYCEE POLYVALENT DES METIERS DU BOIS;39370;MOUCHARD;public;LP;;154.0;154.0;;104.3;104.3;;26.8
2022-2023;BESANCON;039;JURA;0390042J;LYCEE VICTOR CONSIDERANT;39500;SALINS LES BAINS;public;LEGT;280.0;;280.0;119.6;;119.6;33.8;
2022-2023;BESANCON;039;JURA;0390070P;LYCEE GENERAL ET TECHNOLOGIQUE PRIVE SAINTE MARIE;39300;LONS LE SAUNIER;privé sous contrat;LEGT;112.0;;112.0;112.2;;112.2;28.6;
2022-2023;BESANCON;039;JURA;0390094R;LYCEE PROFESSIONNEL PRIVE SAINTE MARIE;39300;LONS LE SAUNIER;privé sous contrat;LP;;80.0;80.0;;98.2;98.2;;26.4
2022-2023;BESANCON;039;JURA;0391001B;LYCEE PROFESSIONNEL PRIVE JEANNE D ARC;39097;CHAMPAGNOLE;privé sous contrat;LP;;111.0;111.0;;97.6;97.6;;27.7
2022-2023;BESANCON;039;JURA;0391131T;INSTITUT EUROPEEN DE FORMATION COMPAGNONS DU TOUR DE FRANCE;39370;MOUCHARD;privé sous contrat;LP;;242.0;242.0;;118.1;118.1;;28.4
2022-2023;BESANCON;039;JURA;0391146J;LYCEE POLYVALENT PRIVE PASTEUR MONT ROLAND;39198;DOLE;privé sous contrat;LPO;256.0;218.0;474.0;113.3;95.5;105.1;27.6;22.3
2022-2023;BORDEAUX;040;LANDES;0400002K;LYCEE POLYVALENT GASTON CRAMPE;40001;AIRE SUR L ADOUR;public;LPO;536.0;109.0;645.0;104.1;90.7;101.9;28.5;27.4
2022-2023;BORDEAUX;040;LANDES;0400004M;LYCEE PROFESSIONNEL LOUIS DARMANTE LYCEE DES METIERS DE L HOTELLERIE ET DU COMMERCE;40065;CAPBRETON;public;LP;;227.0;227.0;;93.1;93.1;;24.7
2022-2023;BORDEAUX;040;LANDES;0400020E;LYCEE PROFESSIONNEL ROBERT WLERICK LYCEE DES METIERS DES SERVICES;40192;MONT DE MARSAN;public;LP;;358.0;358.0;;86.0;86.0;;24.6
2022-2023;BORDEAUX;040;LANDES;0401002X;LYCEE POLYVALENT HAROUN TAZIEFF LYCEE DES METIERS DU BOIS;40279;SAINT PAUL LES DAX;public;LPO;614.0;316.0;930.0;111.0;94.2;105.3;31.2;25.8
2022-2023;ORLEANS-TOURS;041;LOIR-ET-CHER;0410031L;LYCEE PROFESSIONNEL ANDRE AMPERE LYCEE DES METIERSDE LA MAINTENANCE ET DES SERVICES A L INDUSTRIE;41269;VENDOME;public;LP;;455.0;455.0;;91.0;91.0;;26.4
2022-2023;ORLEANS-TOURS;041;LOIR-ET-CHER;0410675L;LYCEE GENERAL ET TECHNOLOGIQUE PRIVE NOTRE DAME DES AYDES;41018;BLOIS;privé sous contrat;LEGT;580.0;;580.0;127.7;;127.7;28.9;
2022-2023;ORLEANS-TOURS;041;LOIR-ET-CHER;0410832G;LYCEE PROFESSIONNEL SONIA DELAUNAY LYCEE DES METIERS DES SERVICES A LA PERSONNE ET DU TERTIAIRE;41018;BLOIS;public;LP;;610.0;610.0;;87.7;87.7;;26.1
2022-2023;ORLEANS-TOURS;041;LOIR-ET-CHER;0410959V;LYCEE GENERAL ET TECHNOLOGIQUE CAMILLE CLAUDEL;41018;BLOIS;public;LEGT;772.0;;772.0;112.3;;112.3;35.0;
2022-2023;LYON;042;LOIRE;0420008F;LYCEE POLYVALENT JEREMIE DE LA RUE;42052;CHARLIEU;public;LPO;355.0;83.0;438.0;112.0;90.3;107.9;31.3;22.6
2022-2023;LYON;042;LOIRE;0420041S;LYCEE GENERAL CLAUDE FAURIEL;42218;SAINT ETIENNE;public;LEGT;929.0;;929.0;109.8;;109.8;38.2;
2022-2023;LYON;042;LOIRE;0420984S;LYCEE PROFESSIONNEL PRIVE SAINTE MARIE LYCEE DES METIERS DE LA VENTE ET DE LA COMMUNICATION VISUELLE;42218;SAINT ETIENNE;privé sous contrat;LP;;258.0;258.0;;100.3;100.3;;26.8
2022-2023;LYON;042;LOIRE;0421489R;LYCEE PROFESSIONNEL ETIENNE LEGRAND LYCEE DES METIERS DU BOIS DU METAL ET DES SERVICES A LA PERSONNE;42071;LE COTEAU;public;LP;;219.0;219.0;;86.1;86.1;;27.7
2022-2023;LYON;042;LOIRE;0421742R;LYCEE PROFESSIONNEL PRIVE TEZENAS DU MONTCEL LYCEE DES METIERS DE LA GESTION ET DU COMMERCE;42218;SAINT ETIENNE;privé sous contrat;LP;;160.0;160.0;;99.2;99.2;;27.2
2022-2023;LYON;042;LOIRE;0421979Y;LYCEE PROFESSIONNEL PRIVE SAINTE ANNE;42187;ROANNE;privé sous contrat;LP;;64.0;64.0;;104.0;104.0;;25.6
2022-2023;LYON;042;LOIRE;0422132P;LYCEE GENERAL L ASTREE;42019;BOËN SUR LIGNON;public;LEGT;228.0;;228.0;113.0;;113.0;33.4;
2022-2023;CLERMONT-FERRAND;043;HAUTE-LOIRE;0430003V;LYCEE GENERAL ET TECHNOLOGIQUE LA FAYETTE;43040;BRIOUDE;public;LEGT;379.0;;379.0;108.5;;108.5;32.1;
2022-2023;NANTES;044;LOIRE-ATLANTIQUE;0440021J;LYCEE GENERAL CLEMENCEAU;44109;NANTES;public;LEGT;860.0;;860.0;136.3;;136.3;37.4;
2022-2023;NANTES;044;LOIRE-ATLANTIQUE;0440024M;LYCEE GENERAL GABRIEL GUIST HAU;44109;NANTES;public;LEGT;820.0;;820.0;145.1;;145.1;30.7;
2022-2023;NANTES;044;LOIRE-ATLANTIQUE;0440036A;LYCEE PROFESSIONNEL LOUIS ANTOINE DE BOUGAINVILLE;44109;NANTES;public;LP;;409.0;409.0;;89.8;89.8;;28.2
2022-2023;NANTES;044;LOIRE-ATLANTIQUE;0440176C;LYCEE GENERAL ET TECHNOLOGIQUE PRIVE SAINT DOMINIQUE;44162;SAINT HERBLAIN;privé sous contrat;LEGT;727.0;;727.0;131.6;;131.6;24.2;
2022-2023;NANTES;044;LOIRE-ATLANTIQUE;0440310Y;LYCEE PROFESSIONNEL JEAN JACQUES AUDUBON;44047;COUËRON;public;LP;;235.0;235.0;;90.0;90.0;;28.8
2022-2023;NANTES;044;LOIRE-ATLANTIQUE;0441653H;LYCEE POLYVALENT PRIVE SAINT JOSEPH LA JOLIVERIE LYCEE DES METIERS;44190;SAINT SEBASTIEN SUR LOIRE;privé sous contrat;LPO;441.0;519.0;960.0;128.7;114.8;121.2;28.1;27.0
2022-2023;NANTES;044;LOIRE-ATLANTIQUE;0441823T;LYCEE PROFESSIONNEL HEINLEX LYCEE DES METIERS;44184;SAINT NAZAIRE;public;LP;;150.0;150.0;;94.1;94.1;;27.9
2022-2023;NANTES;044;LOIRE-ATLANTIQUE;0441993C;LYCEE GENERAL ET TECHNOLOGIQUE CARCOUËT;44109;NANTES;public;LEGT;546.0;;546.0;96.9;;96.9;34.7;
2022-2023;NANTES;044;LOIRE-ATLANTIQUE;0442094M;LYCEE POLYVALENT NICOLAS APPERT LYCEE DES METIERS;44114;ORVAULT;public;LPO;814.0;146.0;960.0;128.6;110.1;125.8;35.2;32.4
2022-2023;NANTES;044;LOIRE-ATLANTIQUE;0442227G;LPO PRIVE INSTITUT DE FORMATION AUX METIERS PARAMEDICAUX LYCEE DES METIERS DU BIEN ETRE : ESTHETIQUE COSMETIQUE PARFUMERIE ET DIETETIQUE;44109;NANTES;privé sous contrat;LPO;20.0;93.0;113.0;113.0;103.9;105.5;35.0;25.8
2022-2023;NANTES;044;LOIRE-ATLANTIQUE;0442778F;LYCEE GENERAL PRIVE SAINT MARTIN;44110;NORT SUR ERDRE;privé sous contrat;LEGT;250.0;;250.0;124.9;;124.9;29.6;
2022-2023;NANTES;044;LOIRE-ATLANTIQUE;0442924P;LYCEE GENERAL ET TECHNOLOGIQUE PRIVE SAINT FRANCOIS D ASSISE;44195;SAVENAY;privé sous contrat;LEGT;422.0;;422.0;118.5;;118.5;29.4;
2022-2023;ORLEANS-TOURS;045;LOIRET;0450064A;LYCEE PROFESSIONNEL GAUDIER BRZESKA LYCEE DES METIERS DU BATIMENT ET DE L ENERGIE DES TRAVAUX PUBLICS ET DU GEOMETRE;45284;SAINT JEAN DE BRAYE;public;LPO;49.0;407.0;456.0;115.6;93.5;95.9;30.1;31.1
2022-2023;ORLEANS-TOURS;045;LOIRET;0450066C;LYCEE PROFESSIONNEL MAL LECLERC LYCEE DES METIERS DE LA MAINTENANCE AUTOMOBILE DES EQUIPEMENTS INDUSTRIELS DU TRANSPORTS ET DE LA LOGISTIQUE;45285;SAINT JEAN DE LA RUELLE;public;LP;;559.0;559.0;;89.3;89.3;;26.2
2022-2023;ORLEANS-TOURS;045;LOIRET;0450750W;LYCEE PROFESSIONNEL JEAN DE LA TAILLE LYCEE DES METIERS DE L ELECTROTECHNIQUE ET DE LA MAINTENANCE INDUSTRIELLE DE L HOTELLERIE ET DU COMMERCE;45252;PITHIVIERS;public;LP;;351.0;351.0;;84.9;84.9;;24.7
2022-2023;ORLEANS-TOURS;045;LOIRET;0450759F;LYCEE PROFESSIONNEL PRIVE L ABBAYE;45028;BEAUGENCY;privé sous contrat;LP;;120.0;120.0;;93.6;93.6;;22.2
2022-2023;ORLEANS-TOURS;045;LOIRET;0451526P;LYCEE GENERAL ET TECHNOLOGIQUE CHARLES PEGUY;45234;ORLEANS;public;LEGT;1388.0;;1388.0;121.4;;121.4;36.5;
2022-2023;TOULOUSE;046;LOT;0460028F;LYCEE POLYVALENT LOUIS VICAT LYCEE DES METIERS CONSTRUCTION ET ENERGETIQUE BATIMENT;46309;SOUILLAC;public;LPO;154.0;52.0;206.0;107.1;96.1;104.3;32.4;24.8
2022-2023;TOULOUSE;046;LOT;0460032K;LP CHAMPOLLION LYCEE DES METIERS DE L INDUSTRIE : PRODUCTIQUE MECANIQUE ELECTRONIQUE ELECTROTECHNIQUE ET BUREAUTIQUE SERVICES;46102;FIGEAC;public;LP;;215.0;215.0;;95.1;95.1;;23.8
2022-2023;TOULOUSE;046;LOT;0460051F;LYCEE PROFESSIONNEL CLEMENT MAROT LYCEE DES METIERS DU TERTIAIRE ET DU SOCIAL;46042;CAHORS;public;LP;;237.0;237.0;;91.7;91.7;;24.9
2022-2023;TOULOUSE;046;LOT;0460493L;LYCEE POLYVALENT GASTON MONNERVILLE LYCEE DES METIERS DE L INDUSTRIE : MAINTENANCE PRODUCTION ELECTRICITE ET AUTOMOBILE;46042;CAHORS;public;LPO;389.0;143.0;532.0;117.5;95.7;111.6;31.9;24.2
2022-2023;BORDEAUX;047;LOT-ET-GARONNE;0470003Y;LYCEE GENERAL ET TECHNOLOGIQUE JEAN BAPTISTE DE BAUDRE;47001;AGEN;public;LEGT;1188.0;;1188.0;107.2;;107.2;31.6;
2022-2023;BORDEAUX;047;LOT-ET-GARONNE;0470004Z;LYCEE PROFESSIONNEL ANTOINE LOMET;47001;AGEN;public;LPO;43.0;451.0;494.0;78.2;88.3;87.4;24.2;26.9
2022-2023;BORDEAUX;047;LOT-ET-GARONNE;0470018P;LYCEE GENERAL ET TECHNOLOGIQUE MARGUERITE FILHOL;47106;FUMEL;public;LEGT;370.0;;370.0;104.2;;104.2;32.0;
2022-2023;BORDEAUX;047;LOT-ET-GARONNE;0470029B;LYCEE PROFESSIONNEL JACQUES DE ROMAS LYCEE DES METIERS DE L HOTELLERIE RESTAURATION ET DES SERVICES A LA PERSONNE;47195;NERAC;public;LP;;335.0;335.0;;84.9;84.9;;26.1
2022-2023;BORDEAUX;047;LOT-ET-GARONNE;0470038L;LYCEE POLYVALENT GEORGES LEYGUES LOUIS COUFFIGNAL;47323;VILLENEUVE SUR LOT;public;LPO;962.0;543.0;1505.0;100.0;82.5;93.7;32.0;24.0
2022-2023;BORDEAUX;047;LOT-ET-GARONNE;0470065R;LYCEE GENERAL ET TECHNOLOGIQUE PRIVE SAINTE CATHERINE;47323;VILLENEUVE SUR LOT;privé sous contrat;LEGT;295.0;;295.0;114.2;;114.2;27.0;
2022-2023;BORDEAUX;047;LOT-ET-GARONNE;0470730N;LYCEE PROFESSIONNEL PRIVE NOTRE DAME LA COMPASSION;47157;MARMANDE;privé sous contrat;LP;;245.0;245.0;;94.1;94.1;;21.6
2022-2023;MONTPELLIER;048;LOZERE;0480009Z;LYCEE D ENSEIGNEMENT GENERAL ET TECHNOLOGIQUE EMILE PEYTAVIN;48095;MENDE;public;LEGT;337.0;;337.0;115.4;;115.4;30.6;
2022-2023;NANTES;049;MAINE-ET-LOIRE;0490001K;LYCEE GENERAL DAVID D ANGERS;49007;ANGERS;public;LEGT;883.0;;883.0;124.1;;124.1;36.4;
2022-2023;NANTES;049;MAINE-ET-LOIRE;0490824E;LYCEE GENERAL PRIVE SAINT BENOIT SITE COLLEGIALE;49007;ANGERS;privé sous contrat;LEGT;620.0;;620.0;136.5;;136.5;25.0;
2022-2023;NANTES;049;MAINE-ET-LOIRE;0490837U;LYCEE GENERAL PRIVE NOTRE DAME;49092;CHEMILLE EN ANJOU;privé sous contrat;LEGT;226.0;;226.0;107.6;;107.6;26.2;
2022-2023;NANTES;049;MAINE-ET-LOIRE;0491646Y;LYCEE PROFESSIONNEL LUDOVIC MENARD;49353;TRELAZE;public;LP;;282.0;282.0;;80.9;80.9;;25.6
2022-2023;NANTES;049;MAINE-ET-LOIRE;0492089E;LYCEE GENERAL ET TECHNOLOGIQUE EMMANUEL MOUNIER;49007;ANGERS;public;LEGT;525.0;;525.0;111.2;;111.2;35.6;
2022-2023;NANTES;049;MAINE-ET-LOIRE;0492285T;LYCEE TECHNOLOGIQUE PRIVE LES ARDILLIERS;49328;SAUMUR;privé sous contrat;LEGT;52.0;;52.0;107.8;;107.8;25.1;
2022-2023;NORMANDIE;050;MANCHE;0500016W;LYCEE GENERAL ET TECHNOLOGIQUE JEAN FRANCOIS MILLET;50129;CHERBOURG EN COTENTIN;public;LEGT;1024.0;;1024.0;113.0;;113.0;31.4;
2022-2023;NORMANDIE;050;MANCHE;0500116E;LYCEE GENERAL PRIVE JEAN PAUL II;50147;COUTANCES;privé sous contrat;LEGT;267.0;;267.0;116.5;;116.5;27.8;
2022-2023;NORMANDIE;050;MANCHE;0500127S;LYCEE TECHNOLOGIQUE PRIVE LE BON SAUVEUR;50502;SAINT LO;privé sous contrat;LEGT;98.0;;98.0;103.6;;103.6;26.4;
2022-2023;NORMANDIE;050;MANCHE;0500132X;LYCEE PROFESSIONNEL PRIVE INGENIEUR CACHIN;50129;CHERBOURG EN COTENTIN;privé sous contrat;LP;;129.0;129.0;;99.9;99.9;;26.6
2022-2023;NORMANDIE;050;MANCHE;0501828R;LYCEE GENERAL ET TECHNOLOGIQUE VICTOR GRIGNARD;50129;CHERBOURG EN COTENTIN;public;LEGT;649.0;;649.0;115.4;;115.4;35.9;
2022-2023;REIMS;051;MARNE;0510035L;LYCEE GENERAL ET TECHNOLOGIQUE HUGUES LIBERGIER LYCEE DES METIERS DES BIOTECHNOLOGIES DE LA CHIMIE DU SOCIAL ET DE L ASSISTANCE AU MANAGEMENT;51454;REIMS;public;LEGT;1049.0;;1049.0;91.4;;91.4;30.8;
2022-2023;REIMS;051;MARNE;0510037N;LYCEE PROFESSIONNEL RAYMOND KOPA LYCEE DES METIERS DE L AGENCEMENT DELA TOPOGRAPHIE ET DE LA COMMERCIALISATION;51454;REIMS;public;LP;;390.0;390.0;;82.0;82.0;;26.3
2022-2023;REIMS;051;MARNE;0511153B;LYCEE PROFESSIONNEL PRIVE JEANNE D ARC LA SALLE;51454;REIMS;privé sous contrat;LP;;130.0;130.0;;109.6;109.6;;27.2
2022-2023;REIMS;051;MARNE;0511884W;LYCEE POLYVALENT GEORGES BRIERE LYCEE DES METIERS DE L INDUSTRIE DE LA DEFENSE ET DU GRAPHISME;51454;REIMS;public;LP;;533.0;533.0;;88.7;88.7;;26.8
2022-2023;REIMS;051;MARNE;0511926S;LYCEE GENERAL ET TECHNOLOGIQUE MARC CHAGALL;51454;REIMS;public;LEGT;952.0;;952.0;121.4;;121.4;35.8;
2022-2023;REIMS;052;HAUTE-MARNE;0520008B;LYCEE PROFESSIONNEL EUGENE DECOMBLE;52121;CHAUMONT;public;LP;;350.0;350.0;;85.3;85.3;;24.1
2022-2023;REIMS;052;HAUTE-MARNE;0520029Z;LYCEE PROFESSIONNEL BLAISE PASCAL;52448;SAINT DIZIER;public;LP;;126.0;126.0;;82.7;82.7;;23.9
2022-2023;NANTES;053;MAYENNE;0530012A;LYCEE GENERAL ET TECHNOLOGIQUE REAUMUR LYCEE DES METIERS;53130;LAVAL;public;LEGT;539.0;;539.0;105.7;;105.7;32.5;
2022-2023;NANTES;053;MAYENNE;0530016E;LYCEE GENERAL ET TECHNOLOGIQUE LAVOISIER;53147;MAYENNE;public;LEGT;581.0;;581.0;110.6;;110.6;33.2;
2022-2023;NANTES;053;MAYENNE;0530046M;LYCEE GENERAL PRIVE SAINT MICHEL;53062;CHATEAU GONTIER SUR MAYENNE;privé sous contrat;LEGT;338.0;;338.0;111.6;;111.6;27.9;
2022-2023;NANTES;053;MAYENNE;0530904V;LYCEE PROFESSIONNEL PRIVE IMMACULEE CONCEPTION;53130;LAVAL;privé sous contrat;LP;;173.0;173.0;;106.3;106.3;;26.8
2022-2023;NANCY-METZ;054;MEURTHE-ET-MOSELLE;0540030P;LYCEE POLYVALENT ALFRED MEZIERES;54323;LONGWY;public;LPO;1413.0;167.0;1580.0;99.2;78.6;97.0;31.8;20.2
2022-2023;NANCY-METZ;054;MEURTHE-ET-MOSELLE;0540067E;LYCEE DES METIERS REGIONAL DU TOULOIS;54528;TOUL;public;LP;;321.0;321.0;;85.5;85.5;;24.3
2022-2023;NANCY-METZ;054;MEURTHE-ET-MOSELLE;0541312H;LYCEE GENERAL PRIVE SAINT PIERRE FOURIER;54329;LUNEVILLE;privé sous contrat;LEGT;115.0;;115.0;111.5;;111.5;28.6;
2022-2023;NANCY-METZ;054;MEURTHE-ET-MOSELLE;0541364P;LYCEE PROFESSIONNEL PRIVE MARIE IMMACULEE;54395;NANCY;privé sous contrat;LP;;221.0;221.0;;97.9;97.9;;29.0
2022-2023;NANCY-METZ;054;MEURTHE-ET-MOSELLE;0541370W;LYCEE PROFESSIONNEL PRIVE CLAUDE DAUNOT;54395;NANCY;privé sous contrat;LP;;241.0;241.0;;102.0;102.0;;26.6
2022-2023;NANCY-METZ;054;MEURTHE-ET-MOSELLE;0541986R;LYCEE GENERAL PRIVE LA MALGRANGE;54274;JARVILLE LA MALGRANGE;privé sous contrat;LEGT;560.0;;560.0;135.2;;135.2;27.0;
2022-2023;NANCY-METZ;054;MEURTHE-ET-MOSELLE;0542161F;LYCEE TECHNOLOGIQUE PRIVE PIERRE DE COUBERTIN;54395;NANCY;privé sous contrat;LEGT;83.0;;83.0;101.0;;101.0;33.8;
2022-2023;NANCY-METZ;054;MEURTHE-ET-MOSELLE;0542408Z;LYCEE GENERAL ET TECHNOLOGIQUE PRIVE CHARLES DE FOUCAULD;54395;NANCY;privé sous contrat;LEGT;190.0;;190.0;119.7;;119.7;27.2;
2022-2023;NANCY-METZ;055;MEUSE;0550891V;LYCEE PROFESSIONNEL EUGENE FREYSSINET;55545;VERDUN;public;LP;;154.0;154.0;;78.7;78.7;;21.8
2022-2023;RENNES;056;MORBIHAN;0560001X;LYCEE PROFESSIONNEL BERTRAND DU GUESCLIN LYCEE DES METIERS D ART;56007;AURAY;public;LP;;332.0;332.0;;105.6;105.6;;31.4
2022-2023;RENNES;056;MORBIHAN;0560025Y;LYCEE GENERAL ET TECHNOLOGIQUE DUPUY DE LOME;56121;LORIENT;public;LEGT;1350.0;;1350.0;121.8;;121.8;35.5;
2022-2023;RENNES;056;MORBIHAN;0560039N;LYCEE PROFESSIONNEL DU BLAVET LYCEE DES METIERS DU BATIMENT ET DU CONFORT DE L HABITAT;56178;PONTIVY;public;LP;;190.0;190.0;;87.6;87.6;;25.0
2022-2023;RENNES;056;MORBIHAN;0560070X;LYCEE PROFESSIONNEL EMILE ZOLA LYCEE DES METIERS DE LA COMMUNICATION VISUELLE;56083;HENNEBONT;public;LP;;266.0;266.0;;91.1;91.1;;25.3
2022-2023;RENNES;056;MORBIHAN;0560105K;LYCEE POLYVALENT PRIVE LA MENNAIS LYCEE DES METIERS DE L ELECTRICITE ET DES SERVICES A L ENTREPRISE;56165;PLOËRMEL;privé sous contrat;LPO;1205.0;293.0;1498.0;113.0;101.1;110.7;27.8;24.7
2022-2023;RENNES;056;MORBIHAN;0560114V;LYCEE GENERAL PRIVE SAINT FRANCOIS XAVIER;56260;VANNES;privé sous contrat;LEGT;680.0;;680.0;128.9;;128.9;27.6;
2022-2023;NANCY-METZ;057;MOSELLE;0570099Y;LYCEE HENRI NOMINE LYCEE DES METIERS DES SERVICES AUX ENTREPRISES;57631;SARREGUEMINES;public;LPO;430.0;228.0;658.0;100.5;83.0;94.4;33.0;27.9
2022-2023;NANCY-METZ;057;MOSELLE;0570100Z;LYCEE PROFESSIONNEL SIMON LAZARD;57631;SARREGUEMINES;public;LP;;599.0;599.0;;85.3;85.3;;26.6
2022-2023;NANCY-METZ;057;MOSELLE;0570108H;LYCEE POLYVALENT LA BRIQUERIE LYCEE DES METIERS DES SCIENCES ET DES TECHNIQUES;57672;THIONVILLE;public;LPO;241.0;638.0;879.0;103.1;81.3;87.3;35.0;26.1
2022-2023;NANCY-METZ;057;MOSELLE;0570216A;LYCEE GENERAL PRIVE SAINT PIERRE CHANEL;57672;THIONVILLE;privé sous contrat;LEGT;892.0;;892.0;129.7;;129.7;28.2;
2022-2023;NANCY-METZ;057;MOSELLE;0570225K;LYCEE PROFESSIONNEL PRIVE INTERENTREPRISES SITES DE BOULAY ET FAULQUEMONT;57097;BOULAY MOSELLE;privé sous contrat;LP;;114.0;114.0;;88.8;88.8;;24.9
2022-2023;NANCY-METZ;057;MOSELLE;0570241C;LYCEE PROFESSIONNEL PRIVE SAINT VINCENT DE PAUL;57012;ALGRANGE;privé sous contrat;LP;;449.0;449.0;;98.4;98.4;;24.6
2022-2023;NANCY-METZ;057;MOSELLE;0570268G;LYCEE PROFESSIONNEL PRIVE SAINTE CHRETIENNE;57606;SAINT AVOLD;privé sous contrat;LP;;126.0;126.0;;97.1;97.1;;26.3
2022-2023;NANCY-METZ;057;MOSELLE;0570294K;LYCEE PROFESSIONNEL PRIVE SAINTE MARIE;57630;SARREBOURG;privé sous contrat;LP;;148.0;148.0;;95.4;95.4;;19.6
2022-2023;NANCY-METZ;057;MOSELLE;0570313F;LYCEE GENERAL ET TECHNOLOGIQUE PRIVE NOTRE DAME DE LA PROVIDENCE;57672;THIONVILLE;privé sous contrat;LEGT;849.0;;849.0;122.2;;122.2;27.4;
2022-2023;NANCY-METZ;057;MOSELLE;0572101Z;LYCEE PROFESSIONNEL PRIVE SAINT ANDRE LYCEE DES METIERS DE L OPTIQUE;57529;OTTANGE;privé sous contrat;LP;;7.0;7.0;;95.4;95.4;;21.4
2022-2023;NANCY-METZ;057;MOSELLE;0572757M;LYCEE GENERAL ET TECHNOLOGIQUE GEORGES DE LA TOUR;57463;METZ;public;LEGT;1431.0;;1431.0;114.2;;114.2;35.6;
2022-2023;NANCY-METZ;057;MOSELLE;0573172N;LYCEE TECHNOLOGIQUE PRIVE SAINTE CHRETIENNE;57606;SAINT AVOLD;privé sous contrat;LEGT;69.0;;69.0;99.6;;99.6;26.6;
2022-2023;NANCY-METZ;057;MOSELLE;0573211F;LYCEE ANDRE CITROEN LYCEE DES METIERS DE L AUTOMOBILE;57447;MARLY;public;LP;;361.0;361.0;;85.2;85.2;;29.1
2022-2023;NANCY-METZ;057;MOSELLE;0573320Z;LYCEE POLYVALENT RAYMOND MONDON LYCEE DES METIERS DE L HOTELLERIE RESTAURATION;57463;METZ;public;LPO;118.0;271.0;389.0;113.6;93.3;99.5;31.7;29.1
2022-2023;DIJON;058;NIEVRE;0580075S;LYCEE PROFESSIONNEL PRIVE THERESE DESREUMAUX;58250;SAINT LEGER DES VIGNES;privé sous contrat;LP;;75.0;75.0;;92.2;92.2;;24.4
2022-2023;LILLE;059;NORD;0590063Y;LYCEE GENERAL ALBERT CHATELET;59178;DOUAI;public;LEGT;910.0;;910.0;117.4;;117.4;38.7;
2022-2023;LILLE;059;NORD;0590093F;LYCEE POLYVALENT BEAUPRE LYCEE DES METIERS DE LA PLASTURGIE;59286;HAUBOURDIN;public;LPO;1040.0;362.0;1402.0;113.7;88.6;107.2;32.9;24.0
2022-2023;LILLE;059;NORD;0590112B;LYCEE GENERAL ET TECHNOLOGIQUE DUPLEIX;59331;LANDRECIES;public;LEGT;360.0;;360.0;102.1;;102.1;32.3;
2022-2023;LILLE;059;NORD;0590116F;LYCEE GENERAL FENELON;59350;LILLE;public;LEGT;643.0;;643.0;116.7;;116.7;40.2;
2022-2023;LILLE;059;NORD;0590133Z;LYCEE PROFESSIONNEL MAURICE DUHAMEL;59360;LOOS;public;LP;;313.0;313.0;;77.5;77.5;;23.3
2022-2023;LILLE;059;NORD;0590143K;LYCEE GENERAL YVES KERNANEC;59378;MARCQ EN BAROEUL;public;LEGT;709.0;;709.0;127.2;;127.2;36.6;
2022-2023;LILLE;059;NORD;0590144L;LYCEE PROFESSIONNEL AUTOMOBILE ALFRED MONGY LYCEE DES METIERS DE LA MAINTENANCE DES VEHICULES;59378;MARCQ EN BAROEUL;public;LP;;425.0;425.0;;84.5;84.5;;26.5
2022-2023;LILLE;059;NORD;0590184E;LYCEE GENERAL JEAN ROSTAND;59512;ROUBAIX;public;LEGT;122.0;;122.0;81.6;;81.6;28.2;
2022-2023;LILLE;059;NORD;0590187H;LYCEE PROFESSIONNEL LOUIS LOUCHEUR;59512;ROUBAIX;public;LP;;185.0;185.0;;69.4;69.4;;20.7
2022-2023;LILLE;059;NORD;0590189K;LYCEE PROFESSIONNEL LAVOISIER;59512;ROUBAIX;public;LP;;314.0;314.0;;70.2;70.2;;19.0
2022-2023;LILLE;059;NORD;0590198V;LYCEE PROFESSIONNEL GEORGES GUYNEMER;59183;DUNKERQUE;public;LP;;304.0;304.0;;78.5;78.5;;23.2
2022-2023;LILLE;059;NORD;0590214M;LYCEE POLYVALENT COLBERT LYCEE DES METIERS DU NUMERIQUE ET DES TECHNOLOGIES INNOVANTES;59599;TOURCOING;public;LPO;535.0;197.0;732.0;94.5;83.5;91.5;35.9;25.2
2022-2023;LILLE;059;NORD;0590217R;LYCEE PROFESSIONNEL SEVIGNE LYCEE DES METIERS;59599;TOURCOING;public;LP;;609.0;609.0;;76.4;76.4;;25.0
2022-2023;LILLE;059;NORD;0590257J;LYCEE PROFESSIONNEL ILE DE FLANDRE;59017;ARMENTIERES;public;LP;;338.0;338.0;;80.1;80.1;;22.7
2022-2023;LILLE;059;NORD;0590265T;LYCEE PROFESSIONNEL EDMOND LABBE;59178;DOUAI;public;LP;;374.0;374.0;;82.0;82.0;;25.6
2022-2023;LILLE;059;NORD;0590270Y;LYCEE PROFESSIONNEL DU HAINAUT LYCEE DES METIERS DE L AUTOMOBILE LYCEE DES METIERS DE LA CHAUDRONNERIE;59606;VALENCIENNES;public;LP;;749.0;749.0;;79.7;79.7;;24.7
2022-2023;LILLE;059;NORD;0592712C;LYCEE PROFESSIONNEL LOUIS ARMAND;59324;JEUMONT;public;LP;;151.0;151.0;;67.7;67.7;;19.2
2022-2023;LILLE;059;NORD;0592913W;LYCEE GENERAL PRIVE NOTRE DAME DES ANGES;59526;SAINT AMAND LES EAUX;privé sous contrat;LEGT;471.0;;471.0;128.5;;128.5;28.2;
2022-2023;LILLE;059;NORD;0592932S;LYCEE GENERAL PRIVE SAINTE MARIE;59056;BEAUCAMPS LIGNY;privé sous contrat;LEGT;1090.0;;1090.0;136.3;;136.3;25.4;
2022-2023;LILLE;059;NORD;0592964B;LYCEE PROFESSIONNEL PRIVE LEONARD DE VINCI;59512;ROUBAIX;privé sous contrat;LP;;154.0;154.0;;93.4;93.4;;23.3
2022-2023;LILLE;059;NORD;0593034C;LYCEE POLYVALENT PRIVE THEOPHILE LEGRAND;59365;LOUVROIL;privé sous contrat;LPO;77.0;196.0;273.0;104.3;93.7;96.7;29.1;24.0
2022-2023;LILLE;059;NORD;0593061G;LYCEE POLYVALENT PRIVE SAINT LUC;59122;CAMBRAI;privé sous contrat;LPO;667.0;466.0;1133.0;120.1;100.7;112.1;29.1;27.7
2022-2023;LILLE;059;NORD;0593063J;LYCEE PROFESSIONNEL PRIVE SAINTE MARIE;59043;BAILLEUL;privé sous contrat;LP;;455.0;455.0;;102.7;102.7;;26.8
2022-2023;LILLE;059;NORD;0593109J;LYCEE GENERAL PRIVE NOTRE DAME DE LA PAIX;59350;LILLE;privé sous contrat;LEGT;361.0;;361.0;136.8;;136.8;25.1;
2022-2023;LILLE;059;NORD;0593113N;LYCEE GENERAL PRIVE SAINTE CLAIRE;59350;LILLE;privé sous contrat;LEGT;241.0;;241.0;123.3;;123.3;31.1;
2022-2023;LILLE;059;NORD;0594424N;LYCEE GENERAL ET TECHNOLOGIQUE RAYMOND QUENEAU;59009;VILLENEUVE D ASCQ;public;LEGT;817.0;;817.0;104.9;;104.9;39.1;
2022-2023;LILLE;059;NORD;0594532F;LYCEE PROFESSIONNEL AMBROISE CROIZAT;59028;AUBY;public;LP;;228.0;228.0;;71.3;71.3;;19.6
2022-2023;LILLE;059;NORD;0595809U;LYCEE GENERAL ET TECHNOLOGIQUE DE L ESCAUT;59606;VALENCIENNES;public;LEGT;1147.0;;1147.0;100.9;;100.9;35.1;
2022-2023;LILLE;059;NORD;0595867G;LYCEE GENERAL ET TECHNOLOGIQUE INTERNATIONAL MONTEBELLO;59350;LILLE;public;LEGT;1321.0;;1321.0;105.1;;105.1;41.3;
2022-2023;LILLE;059;NORD;0596681S;LYCEE GENERAL ET TECHNOLOGIQUE PRIVE AVERROES;59350;LILLE;privé sous contrat;LEGT;360.0;;360.0;112.9;;112.9;30.1;
2022-2023;LILLE;059;NORD;0596892W;LYCEE D EXCELLENCE EDGAR MORIN;59178;DOUAI;public;LEGT;166.0;;166.0;91.2;;91.2;29.5;
2022-2023;AMIENS;060;OISE;0600002B;LYCEE POLYVALENT PAUL LANGEVIN LYCEE DES METIERS DE L INDUSTRIE ET DU GENIE CIVIL;60057;BEAUVAIS;public;LPO;1035.0;278.0;1313.0;103.7;88.3;100.4;30.3;24.0
