2022-2023;LILLE;059;NORD;0592916Z;LYCEE GENERAL ET TECHNOLOGIQUE PRIVE NOTRE DAME DE GRACE;59392;MAUBEUGE;privé sous contrat;LEGT;351.0;;351.0;112.3;;112.3;30.7;
2022-2023;LILLE;059;NORD;0592921E;LYCEE GENERAL ET TECHNOLOGIQUE PRIVE SAINT REMI;59512;ROUBAIX;privé sous contrat;LEGT;1424.0;;1424.0;105.3;;105.3;31.8;
2022-2023;LILLE;059;NORD;0592929N;LYCEE GENERAL ET TECHNOLOGIQUE PRIVE SAINTE THERESE;59036;AVESNES SUR HELPE;privé sous contrat;LEGT;132.0;;132.0;110.7;;110.7;31.0;
2022-2023;LILLE;059;NORD;0593007Y;LYCEE GENERAL ET TECHNOLOGIQUE PRIVE FREDERIC OZANAM LYCEE DES METIERS DE LA CONSTRUCTION DE L ENVIRONNEMENT ET DES ENERGIES;59350;LILLE;privé sous contrat;LEGT;764.0;;764.0;132.7;;132.7;28.0;
2022-2023;LILLE;059;NORD;0593066M;LYCEE PROFESSIONNEL PRIVE JEAN PAUL II;59172;DENAIN;privé sous contrat;LP;;362.0;362.0;;85.6;85.6;;22.6
2022-2023;LILLE;059;NORD;0593077Z;LYCEE POLYVALENT PRIVE SAINT JOSEPH;59295;HAZEBROUCK;privé sous contrat;LPO;115.0;162.0;277.0;109.4;96.6;101.9;27.3;21.9
2022-2023;LILLE;059;NORD;0593079B;LYCEE PROFESSIONNEL PRIVE SAINTE BERNADETTE;59324;JEUMONT;privé sous contrat;LP;;142.0;142.0;;90.6;90.6;;20.0
2022-2023;LILLE;059;NORD;0593102B;LYCEE GENERAL PRIVE NOTRE DAME DES DUNES;59183;DUNKERQUE;privé sous contrat;LEGT;549.0;;549.0;123.2;;123.2;28.4;
2022-2023;LILLE;059;NORD;0593106F;LYCEE GENERAL PRIVE SAINTE ODILE;59328;LAMBERSART;privé sous contrat;LEGT;456.0;;456.0;131.0;;131.0;27.8;
2022-2023;LILLE;059;NORD;0593136N;LYCEE GENERAL ET TECHNOLOGIQUE PRIVE SAINT JACQUES;59295;HAZEBROUCK;privé sous contrat;LEGT;540.0;;540.0;123.7;;123.7;28.6;
2022-2023;LILLE;059;NORD;0593225K;LYCEE PRIVE DE MARCQ;59378;MARCQ EN BAROEUL;privé sous contrat;LEGT;949.0;;949.0;144.7;;144.7;18.7;
2022-2023;LILLE;059;NORD;0594391C;LYCEE TECHNOLOGIQUE ECOLE SUP ARTS APPLIQUES TEXTILE;59512;ROUBAIX;public;LEGT;212.0;;212.0;130.3;;130.3;37.2;
2022-2023;LILLE;059;NORD;0594652L;LYCEE PROFESSIONNEL DES PLAINES DU NORD;59271;GRANDE SYNTHE;public;LP;;141.0;141.0;;70.0;70.0;;17.2
2022-2023;LILLE;059;NORD;0595786U;LYCEE GENERAL ET TECHNOLOGIQUE JEAN PROUVE;59350;LILLE;public;LEGT;237.0;;237.0;103.5;;103.5;34.1;
2022-2023;AMIENS;060;OISE;0600009J;LYCEE GENERAL ET TECHNOLOGIQUE JEAN ROSTAND;60141;CHANTILLY;public;LEGT;1152.0;;1152.0;127.4;;127.4;33.7;
2022-2023;AMIENS;060;OISE;0600014P;LYCEE GENERAL ET TECHNOLOGIQUE PIERRE D AILLY;60159;COMPIEGNE;public;LEGT;1179.0;;1179.0;121.0;;121.0;35.4;
2022-2023;AMIENS;060;OISE;0600020W;LYCEE D ENSEIGNEMENT GENERAL ET TECHNOLOGIQUE MARIE CURIE;60463;NOGENT SUR OISE;public;LEGT;1418.0;;1418.0;101.4;;101.4;35.2;
2022-2023;AMIENS;060;OISE;0600041U;LYCEE PROFESSIONNEL CHARLES DE BOVELLES LYCEE DES METIERS;60471;NOYON;public;LP;;376.0;376.0;;84.4;84.4;;25.8
2022-2023;AMIENS;060;OISE;0601164P;LYCEE PROFESSIONNEL PRIVE CROISET;60141;CHANTILLY;privé sous contrat;LP;;44.0;44.0;;123.0;123.0;;27.8
2022-2023;AMIENS;060;OISE;0601822E;LYCEE PROFESSIONNEL ARTHUR RIMBAUD LYCEE DES METIERS DE L ELECTRONIQUE DE LA MENUISERIE ET DE LA VENTE;60537;RIBECOURT DRESLINCOURT;public;LP;;388.0;388.0;;83.6;83.6;;24.1
2022-2023;AMIENS;060;OISE;0601826J;LYCEE GENERAL ET TECHNOLOGIQUE HUGUES CAPET;60612;SENLIS;public;LEGT;768.0;;768.0;119.2;;119.2;32.8;
2022-2023;AMIENS;060;OISE;0601832R;LYCEE GENERAL ET TECHNOLOGIQUE JEAN MONNET;60176;CREPY EN VALOIS;public;LEGT;1104.0;;1104.0;108.9;;108.9;30.6;
2022-2023;AMIENS;060;OISE;0601870G;LYCEE PROFESSIONNEL ANDRE MALRAUX LYCEE DES METIERS DU TERTIAIRE ET DES SERVICES A LA PERSONNE;60414;MONTATAIRE;public;LP;;424.0;424.0;;78.7;78.7;;24.1
2022-2023;AMIENS;060;OISE;0601947R;LYCEE PROFESSIONNEL PRIVE SEVIGNE;60159;COMPIEGNE;privé sous contrat;LP;;33.0;33.0;;117.8;117.8;;28.8
2022-2023;AMIENS;060;OISE;0601950U;LYCEE TECHNOLOGIQUE PRIVE ST VINCENT DE PAUL;60057;BEAUVAIS;privé sous contrat;LEGT;71.0;;71.0;106.4;;106.4;28.8;
2022-2023;NORMANDIE;061;ORNE;0610006A;LYCEE POLYVALENT MEZERAY GABRIEL;61006;ARGENTAN;public;LPO;604.0;274.0;878.0;100.5;80.0;94.1;31.8;22.7
2022-2023;NORMANDIE;061;ORNE;0610018N;LYCEE POLYVALENT DES ANDAINES LYCEE DES METIERS DU BOIS ET DE LA TRANSITION ECOLOGIQUE;61168;LA FERTE MACE;public;LPO;213.0;46.0;259.0;106.1;81.3;101.7;31.1;22.9
2022-2023;NORMANDIE;061;ORNE;0610694Y;LYCEE GENERAL PRIVE JEANNE D ARC;61006;ARGENTAN;privé sous contrat;LEGT;123.0;;123.0;119.9;;119.9;27.9;
2022-2023;NORMANDIE;061;ORNE;0610698C;LYCEE POLYVALENT PRIVE SAINT THOMAS D AQUIN;61169;FLERS;privé sous contrat;LPO;454.0;119.0;573.0;116.1;103.5;113.5;28.9;26.5
2022-2023;LILLE;062;PAS-DE-CALAIS;0620187S;LYCEE PROFESSIONNEL JULES VERNE LYCEE DES METIERS DU BATIMENT ET DES ENERGIES RENOUVELABLES;62318;ETAPLES;public;LP;;144.0;144.0;;75.8;75.8;;21.2
2022-2023;LILLE;062;PAS-DE-CALAIS;0620258U;LYCEE PROFESSIONNEL VOLTAIRE;62895;WINGLES;public;LP;;563.0;563.0;;83.9;83.9;;24.5
2022-2023;LILLE;062;PAS-DE-CALAIS;0622089J;LYCEE PROFESSIONNEL ANDRE MALRAUX;62119;BETHUNE;public;LP;;635.0;635.0;;80.2;80.2;;24.3
2022-2023;LILLE;062;PAS-DE-CALAIS;0622192W;LYCEE PROFESSIONNEL PRIVE SAINT JOSEPH LYCEE DES METIERS MANAGEMENT GESTION COMMUNICATION;62318;ETAPLES;privé sous contrat;LP;;119.0;119.0;;89.8;89.8;;19.8
2022-2023;LILLE;062;PAS-DE-CALAIS;0622196A;LYCEE POLYVALENT PRIVE BAUDIMONT LYCEE DES METIERS DU TERTIAIRE COMMERCIAL ET DU MANAGEMENT;62041;ARRAS;privé sous contrat;LPO;1175.0;270.0;1445.0;127.5;109.6;124.2;28.0;30.1
2022-2023;LILLE;062;PAS-DE-CALAIS;0622801H;LYCEE PROFESSIONNEL JEAN BERTIN LYCEE DES METIERS DES TRAVAUX PUBLICS;62178;BRUAY LA BUISSIERE;public;LP;;517.0;517.0;;89.4;89.4;;26.0
2022-2023;LILLE;062;PAS-DE-CALAIS;0622803K;LYCEE GENERAL ET TECHNOLOGIQUE BLAISE PASCAL;62525;LONGUENESSE;public;LEGT;936.0;;936.0;104.4;;104.4;32.8;
2022-2023;LILLE;062;PAS-DE-CALAIS;0622807P;LYCEE POLYVALENT HOTELIER;62826;LE TOUQUET PARIS PLAGE;public;LPO;109.0;122.0;231.0;121.0;108.7;114.5;32.2;32.8
2022-2023;LILLE;062;PAS-DE-CALAIS;0622949U;LYCEE GENERAL ET TECHNOLOGIQUE MARIETTE;62160;BOULOGNE SUR MER;public;LEGT;1228.0;;1228.0;103.5;;103.5;37.2;
2022-2023;LILLE;062;PAS-DE-CALAIS;0623377J;LYCEE PROFESSIONNEL DU BATIMENT FRANCOIS HENNEBIQUE;62510;LIEVIN;public;LP;;287.0;287.0;;72.5;72.5;;18.3
2022-2023;LILLE;062;PAS-DE-CALAIS;0623463C;LYCEE PROFESSIONNEL NORMANDIE NIEMEN LYCEE DES METIERS DU BATIMENT ET DES ENERGIES RENOUVELABLES;62193;CALAIS;public;LP;;226.0;226.0;;74.0;74.0;;20.4
2022-2023;LILLE;062;PAS-DE-CALAIS;0624109E;LYCEE POLYVALENT GIRAUX SANNIER;62758;SAINT MARTIN BOULOGNE;public;LPO;554.0;245.0;799.0;103.0;78.1;95.4;34.1;23.8
2022-2023;CLERMONT-FERRAND;063;PUY-DE-DOME;0630001J;LYCEE POLYVALENT BLAISE PASCAL;63003;AMBERT;public;LPO;315.0;150.0;465.0;105.9;83.1;98.5;32.3;22.8
2022-2023;CLERMONT-FERRAND;063;PUY-DE-DOME;0630019D;LYCEE INTERNATIONAL JEANNE D ARC;63113;CLERMONT FERRAND;public;LEGT;1378.0;;1378.0;125.6;;125.6;37.9;
2022-2023;CLERMONT-FERRAND;063;PUY-DE-DOME;0630041C;LYCEE PROFESSIONNEL HENRI SAINTE CLAIRE DEVILLE LYCEE DES METIERS DES TECHNOLOGIES INDUSTRIELLES;63178;ISSOIRE;public;LP;;244.0;244.0;;85.5;85.5;;25.3
2022-2023;CLERMONT-FERRAND;063;PUY-DE-DOME;0630052P;LYCEE GENERAL ET TECHNOLOGIQUE C ET P VIRLOGEUX;63300;RIOM;public;LEGT;1315.0;;1315.0;118.4;;118.4;34.3;
2022-2023;CLERMONT-FERRAND;063;PUY-DE-DOME;0630069H;LYCEE GENERAL ET TECHNOLOGIQUE JEAN ZAY;63430;THIERS;public;LEGT;281.0;;281.0;110.2;;110.2;33.2;
2022-2023;CLERMONT-FERRAND;063;PUY-DE-DOME;0630078T;LYCEE PROFESSIONNEL GERMAINE TILLION;63430;THIERS;public;LP;;264.0;264.0;;78.0;78.0;;20.6
2022-2023;CLERMONT-FERRAND;063;PUY-DE-DOME;0631050Z;LYCEE PROFESSIONNEL PRIVE ANNA RODIER LYCEE DES METIERS DE L INDUSTRIE ET DES SERVICES AUX ENTREPRISES;63113;CLERMONT FERRAND;privé sous contrat;LP;;115.0;115.0;;104.2;104.2;;25.3
2022-2023;CLERMONT-FERRAND;063;PUY-DE-DOME;0631737W;LYCEE PROFESSIONNEL PRIVE SAINT ALYRE;63113;CLERMONT FERRAND;privé sous contrat;LP;;71.0;71.0;;103.5;103.5;;26.4
2022-2023;CLERMONT-FERRAND;063;PUY-DE-DOME;0631861F;LYCEE GENERAL ET TECHNOLOGIQUE RENE DESCARTES;63124;COURNON D AUVERGNE;public;LEGT;1408.0;;1408.0;120.3;;120.3;33.9;
2022-2023;BORDEAUX;064;PYRENEES-ATLANTIQUES;0640011P;LYCEE GENERAL ET TECHNOLOGIQUE LOUIS DE FOIX;64102;BAYONNE;public;LEGT;775.0;;775.0;107.8;;107.8;30.2;
2022-2023;BORDEAUX;064;PYRENEES-ATLANTIQUES;0640013S;LYCEE PROFESSIONNEL PAUL BERT LYCEE DES METIERS DU TERTIAIRE ET DES SERVICES;64102;BAYONNE;public;LP;;500.0;500.0;;90.7;90.7;;27.2
2022-2023;BORDEAUX;064;PYRENEES-ATLANTIQUES;0640017W;LYCEE GENERAL EXPERIMENTAL ANDRE MALRAUX;64122;BIARRITZ;public;LEGT;666.0;;666.0;127.9;;127.9;33.5;
2022-2023;BORDEAUX;064;PYRENEES-ATLANTIQUES;0640028H;LYCEE PROFESSIONNEL AIZPURDI;64260;HENDAYE;public;LP;;227.0;227.0;;89.5;89.5;;25.5
2022-2023;BORDEAUX;064;PYRENEES-ATLANTIQUES;0640042Y;LYCEE PROFESSIONNEL HAUTE VUE LYCEE DES METIERS DU GOUT ET DES SOINS ET DES SERVICES A LA PERSONNE;64405;MORLAAS;public;LP;;389.0;389.0;;92.6;92.6;;27.6
2022-2023;BORDEAUX;064;PYRENEES-ATLANTIQUES;0640046C;LYCEE GENERAL PAUL REY;64417;NAY;public;LEGT;476.0;;476.0;122.7;;122.7;32.8;
2022-2023;BORDEAUX;064;PYRENEES-ATLANTIQUES;0640058R;LYCEE PROFESSIONNEL HONORE BARADAT;64445;PAU;public;LP;;418.0;418.0;;85.7;85.7;;28.0
2022-2023;BORDEAUX;064;PYRENEES-ATLANTIQUES;0640111Y;LYCEE GENERAL ET TECHNOLOGIQUE PRIVE LARGENTE;64102;BAYONNE;privé sous contrat;LEGT;552.0;;552.0;123.2;;123.2;27.2;
2022-2023;BORDEAUX;064;PYRENEES-ATLANTIQUES;0640115C;LYCEE GENERAL PRIVE SAINT LOUIS VILLA PIA;64102;BAYONNE;privé sous contrat;LEGT;726.0;;726.0;129.2;;129.2;25.8;
2022-2023;BORDEAUX;064;PYRENEES-ATLANTIQUES;0640131V;LYCEE GENERAL ET TECHNOLOGIQUE PRIVE SAINT DOMINIQUE;64445;PAU;privé sous contrat;LEGT;496.0;;496.0;130.4;;130.4;26.8;
2022-2023;BORDEAUX;064;PYRENEES-ATLANTIQUES;0640137B;LYCEE GENERAL ET TECHNOLOGIQUE PRIVE SAINT JOSEPH;64547;USTARITZ;privé sous contrat;LEGT;233.0;;233.0;113.6;;113.6;26.1;
2022-2023;BORDEAUX;064;PYRENEES-ATLANTIQUES;0640181Z;LYCEE PROFESSIONNEL PRIVE SAINT JOSEPH LYCEE DES METIERS DES SCIENCES ET TECHNIQUES INDUSTRIELLES;64256;HASPARREN;privé sous contrat;LPO;237.0;209.0;446.0;114.0;104.7;109.7;28.5;26.3
2022-2023;BORDEAUX;064;PYRENEES-ATLANTIQUES;0640184C;LP PRIVE MONTPENSIER LYCEE DES METIERS DE LA SANTE DE L ANIMATION DE L ORGANISATION ADMINISTRATIVE COMMERCIALE DU TRANSPORT;64445;PAU;privé sous contrat;LP;;397.0;397.0;;105.3;105.3;;28.6
2022-2023;BORDEAUX;064;PYRENEES-ATLANTIQUES;0640189H;LYCEE PROFESSIONNEL PRIVE SAINT VINCENT DE PAUL LYCEES DES METIERS DE LA RESTAURATION;64445;PAU;privé sous contrat;LP;;115.0;115.0;;98.9;98.9;;28.6
2022-2023;BORDEAUX;064;PYRENEES-ATLANTIQUES;0641839B;LYCEE GENERAL ET TECHNOLOGIQUE JACQUES MONOD;64335;LESCAR;public;LEGT;759.0;;759.0;121.8;;121.8;31.5;
2022-2023;TOULOUSE;065;HAUTES-PYRENEES;0650012K;LYCEE GENERAL MICHELET;65258;LANNEMEZAN;public;LEGT;460.0;;460.0;114.7;;114.7;30.9;
2022-2023;TOULOUSE;065;HAUTES-PYRENEES;0650014M;LYCEE PROFESSIONNEL DE L ARROUZA LYCEE DES METIERS DE L HOTELLERIE RESTAURATION DU COMMERCE ET DU WEB MARKETING;65286;LOURDES;public;LPO;30.0;129.0;159.0;113.9;89.7;94.3;30.3;27.3
2022-2023;TOULOUSE;065;HAUTES-PYRENEES;0650038N;LYCEE GENERAL PIERRE MENDES FRANCE;65460;VIC EN BIGORRE;public;LEGT;262.0;;262.0;110.4;;110.4;30.0;
2022-2023;TOULOUSE;065;HAUTES-PYRENEES;0650058K;LYCEE GENERAL PRIVE PEYRAMALE SAINT JOSEPH;65286;LOURDES;privé sous contrat;LEGT;230.0;;230.0;105.0;;105.0;28.2;
2022-2023;TOULOUSE;065;HAUTES-PYRENEES;0650874X;LYCEE PROFESSIONNEL LAUTREAMONT LYCEE INTERNATIONAL DES METIERS DE L HOTELLERIE RESTAURATION DE L ALIMENTATION ET DES SERVICES TERTIAIRES;65440;TARBES;public;LP;;336.0;336.0;;91.7;91.7;;27.1
2022-2023;MONTPELLIER;066;PYRENEES-ORIENTALES;0660010C;LYCEE GENERAL ET TECHNOLOGIQUE FRANCOIS ARAGO;66136;PERPIGNAN;public;LEGT;1650.0;;1650.0;107.9;;107.9;36.6;
2022-2023;MONTPELLIER;066;PYRENEES-ORIENTALES;0660011D;LYCEE POLYVALENT JEAN LURCAT LYCEE DES METIERS DES ARTS ET SERVICES AUX ORGANISATIONS;66136;PERPIGNAN;public;LPO;1163.0;334.0;1497.0;96.9;85.8;94.4;32.6;25.3
2022-2023;MONTPELLIER;066;PYRENEES-ORIENTALES;0660057D;LYCEE CLIMATIQUE ET SPORTIF PIERRE DE COUBERTIN;66124;FONT ROMEU ODEILLO VIA;public;LPO;446.0;45.0;491.0;119.6;93.5;117.2;33.2;24.9
2022-2023;MONTPELLIER;066;PYRENEES-ORIENTALES;0660077A;LYCEE POLYVALENT PRIVE SAINTE LOUISE DE MARILLAC;66136;PERPIGNAN;privé sous contrat;LPO;66.0;348.0;414.0;116.3;108.0;109.3;30.3;27.3
2022-2023;STRASBOURG;067;BAS-RHIN;0670067J;LYCEE PROFESSIONNEL HAUTE BRUCHE;67448;SCHIRMECK;public;LP;;75.0;75.0;;86.4;86.4;;27.0
2022-2023;STRASBOURG;067;BAS-RHIN;0670079X;LYCEE GENERAL FUSTEL DE COULANGES;67482;STRASBOURG;public;LEGT;854.0;;854.0;129.9;;129.9;36.4;
2022-2023;STRASBOURG;067;BAS-RHIN;0670127Z;LYCEE PROFESSIONNEL JEAN FREDERIC OBERLIN LYCEE DES METIERS;67482;STRASBOURG;public;LP;;559.0;559.0;;81.1;81.1;;25.0
2022-2023;STRASBOURG;067;BAS-RHIN;0670129B;LYCEE PROFESSIONNEL JEAN GEILER;67482;STRASBOURG;public;LP;;482.0;482.0;;76.2;76.2;;22.5
2022-2023;STRASBOURG;067;BAS-RHIN;0671552Y;LYCEE GENERAL PRIVE LE GYMNASE JEAN STURM;67482;STRASBOURG;privé sous contrat;LEGT;771.0;;771.0;143.1;;143.1;25.1;
2022-2023;STRASBOURG;067;BAS-RHIN;0672615D;LYCEE POLYVALENT LOUIS MARCHAL;67300;MOLSHEIM;public;LPO;486.0;183.0;669.0;114.7;88.8;107.6;34.5;27.1
2022-2023;STRASBOURG;067;BAS-RHIN;0672616E;LYCEE POLYVALENT GUTENBERG LYCEE DES METIERS DES INDUSTRIES GRAPHIQUES;67218;ILLKIRCH GRAFFENSTADEN;public;LP;;275.0;275.0;;101.1;101.1;;30.5
2022-2023;STRASBOURG;067;BAS-RHIN;0672677W;LYCEE POLYVALENT MARGUERITE YOURCENAR;67130;ERSTEIN;public;LPO;829.0;72.0;901.0;121.3;88.4;118.7;34.2;28.7
2022-2023;STRASBOURG;067;BAS-RHIN;0672806L;LYCEE POLYVALENT MARCEL RUDLOFF;67482;STRASBOURG;public;LPO;1007.0;251.0;1258.0;99.8;78.8;95.6;35.3;26.4
2022-2023;STRASBOURG;068;HAUT-RHIN;0680001G;LYCEE POLYVALENT JEAN JACQUES HENNER;68004;ALTKIRCH;public;LPO;1269.0;391.0;1660.0;112.2;87.2;106.3;33.8;25.6
2022-2023;STRASBOURG;068;HAUT-RHIN;0680034T;LYCEE GENERAL ET TECHNOLOGIQUE LOUIS ARMAND;68224;MULHOUSE;public;LEGT;1022.0;;1022.0;98.2;;98.2;36.2;
2022-2023;STRASBOURG;068;HAUT-RHIN;0680037W;LYCEE PROFESSIONNEL CHARLES STOESSEL LYCEE DES METIERS;68224;MULHOUSE;public;LPO;13.0;391.0;404.0;71.8;70.6;70.7;18.6;21.1
2022-2023;STRASBOURG;068;HAUT-RHIN;0680039Y;LYCEE PROFESSIONNEL F D ROOSEVELT LYCEE DES METIERS;68224;MULHOUSE;public;LP;;567.0;567.0;;74.6;74.6;;22.5
2022-2023;STRASBOURG;068;HAUT-RHIN;0680134B;LYCEE GENERAL PRIVE DON BOSCO;68174;LANDSER;privé sous contrat;LEGT;428.0;;428.0;133.6;;133.6;27.7;
2022-2023;STRASBOURG;068;HAUT-RHIN;0680151V;INSTITUTION SAINTE JEANNE D ARC;68224;MULHOUSE;privé sous contrat;LEGT;681.0;;681.0;126.9;;126.9;29.6;
2022-2023;STRASBOURG;068;HAUT-RHIN;0680154Y;LYCEE PROFESSIONNEL PRIVE INSTITUT SONNENBERG LYCEE DES METIERS;68062;CARSPACH;privé sous contrat;LP;;153.0;153.0;;100.0;100.0;;26.5
2022-2023;STRASBOURG;068;HAUT-RHIN;0681809X;LYCEE POLYVALENT E BUGATTI LYCEE DES METIERS DE L AUTOMOBILE DU TRANSPORT ET DE LA LOGISTIQUE;68154;ILLZACH;public;LP;;576.0;576.0;;77.7;77.7;;25.1
2022-2023;STRASBOURG;068;HAUT-RHIN;0681810Y;LYCEE PROFESSIONNEL GUSTAVE EIFFEL LYCEES DES METIERS DU BATIMENT ET DES TRAVAUX PUBLICS;68063;CERNAY;public;LP;;364.0;364.0;;84.6;84.6;;25.3
2022-2023;STRASBOURG;068;HAUT-RHIN;0681817F;LYCEE POLYVALENT LAZARE DE SCHWENDI LYCEE DES METIERS;68155;INGERSHEIM;public;LPO;69.0;120.0;189.0;107.0;80.6;90.2;30.3;23.5
2022-2023;LYON;069;RHONE;0690008J;LYCEE PROFESSIONNEL GUSTAVE EIFFEL;69027;BRIGNAIS;public;LP;;154.0;154.0;;80.3;80.3;;24.1
2022-2023;LYON;069;RHONE;0690023A;LYCEE GENERAL ET TECHNOLOGIQUE AMPERE;69382;LYON 2E ARRONDISSEMENT;public;LEGT;970.0;;970.0;121.1;;121.1;39.8;
2022-2023;LYON;069;RHONE;0690027E;LYCEE GENERAL ET TECHNOLOGIQUE EDOUARD HERRIOT;69386;LYON 6E ARRONDISSEMENT;public;LEGT;788.0;;788.0;130.5;;130.5;39.0;
2022-2023;LYON;069;RHONE;0690031J;LYCEE GENERAL ET TECHNOLOGIQUE ANTOINE DE SAINT EXUPERY;69384;LYON 4E ARRONDISSEMENT;public;LEGT;1339.0;;1339.0;133.4;;133.4;35.7;
2022-2023;LYON;069;RHONE;0690032K;LYCEE GENERAL ET TECHNOLOGIQUE JULIETTE RECAMIER;69382;LYON 2E ARRONDISSEMENT;public;LEGT;566.0;;566.0;105.0;;105.0;36.1;
2022-2023;LYON;069;RHONE;0690038S;LYCEE GENERAL ET TECHNOLOGIQUE LA MARTINIERE DUCHERE;69389;LYON 9E ARRONDISSEMENT;public;LEGT;932.0;;932.0;103.5;;103.5;37.8;
2022-2023;LYON;069;RHONE;0690129R;LYCEE PROFESSIONNEL EDMOND LABBE LYCEE DES METIERS DE L ENERGIE;69149;OULLINS;public;LP;;352.0;352.0;;81.9;81.9;;23.7
2022-2023;LYON;069;RHONE;0690552A;LYCEE GENERAL PRIVE NOTRE DAME DE MONGRE;69264;VILLEFRANCHE SUR SAONE;privé sous contrat;LEGT;680.0;;680.0;130.5;;130.5;27.8;
2022-2023;LYON;069;RHONE;0690553B;LYCEE TECHNOLOGIQUE PRIVE NOTRE DAME;69264;VILLEFRANCHE SUR SAONE;privé sous contrat;LEGT;307.0;;307.0;123.6;;123.6;27.3;
2022-2023;LYON;069;RHONE;0690574Z;LYCEE GENERAL ET TECHNOLOGIQUE PRIVE CHEVREUL LESTONNAC;69387;LYON 7E ARRONDISSEMENT;privé sous contrat;LEGT;898.0;;898.0;132.3;;132.3;26.1;
2022-2023;LYON;069;RHONE;0690634P;LYCEE TECHNOLOGIQUE PRIVE LA MACHE;69388;LYON 8E ARRONDISSEMENT;privé sous contrat;LEGT;284.0;;284.0;133.0;;133.0;25.9;
2022-2023;LYON;069;RHONE;0690652J;LYCEE PROFESSIONNEL PRIVE ATELIERS D APPRENTISSAGE DE L INDUSTRIE;69256;VAULX EN VELIN;privé sous contrat;LP;;78.0;78.0;;109.0;109.0;;31.4
2022-2023;LYON;069;RHONE;0691723Y;LYCEE PROFESSIONNEL PRIVE DE COIFFURE DE LYON;69384;LYON 4E ARRONDISSEMENT;privé sous contrat;LP;;65.0;65.0;;91.8;91.8;;23.4
2022-2023;LYON;069;RHONE;0693330V;LYCEE POLYVALENT ARAGON PICASSO LYCEE DES METIERS;69091;GIVORS;public;LPO;1122.0;294.0;1416.0;105.7;81.0;100.6;35.9;24.6
2022-2023;LYON;069;RHONE;0693478F;LYCEE GENERAL ET TECHNOLOGIQUE CONDORCET;69290;SAINT PRIEST;public;LEGT;1391.0;;1391.0;102.8;;102.8;33.9;
2022-2023;LYON;069;RHONE;0693619J;LYCEE GENERAL ET TECHNOLOGIQUE ROBERT DOISNEAU;69256;VAULX EN VELIN;public;LEGT;704.0;;704.0;83.7;;83.7;28.8;
2022-2023;LYON;069;RHONE;0694066V;LYCEE GENERAL PRIVE BETH HANNA;69266;VILLEURBANNE;privé sous contrat;LEGT;26.0;;26.0;121.1;;121.1;25.9;
2022-2023;LYON;069;RHONE;0694405N;LYCEE GENERAL ET TECHNOLOGIQUE DOCTEUR CHARLES MERIEUX;69387;LYON 7E ARRONDISSEMENT;public;LEGT;573.0;;573.0;114.3;;114.3;38.2;
2022-2023;BESANCON;070;HAUTE-SAONE;0700018P;LYCEE POLYVALENT GEORGES COLOMB;70310;LURE;public;LPO;734.0;115.0;849.0;107.3;81.5;103.8;34.0;24.5
2022-2023;BESANCON;070;HAUTE-SAONE;0700882D;LYCEE PROFESSIONNEL PONTARCHER;70550;VESOUL;public;LP;;406.0;406.0;;83.4;83.4;;23.6
2022-2023;BESANCON;070;HAUTE-SAONE;0701035V;LPO LOUIS ARAGON LYCEE DES METIERS DE L ENERGIE ET DU DEVELOPPEMENT DURABLE;70285;HERICOURT;public;LPO;445.0;71.0;516.0;113.0;88.8;109.7;35.8;26.8
2022-2023;DIJON;071;SAONE-ET-LOIRE;0710011B;LYCEE GENERAL PONTUS DE TYARD;71076;CHALON SUR SAONE;public;LEGT;807.0;;807.0;125.7;;125.7;34.8;
2022-2023;DIJON;071;SAONE-ET-LOIRE;0710048S;LYCEE POLYVALENT RENE CASSIN LYCEE DES METIERS;71270;MACON;public;LPO;729.0;393.0;1122.0;104.9;87.3;98.7;33.2;26.9
2022-2023;DIJON;071;SAONE-ET-LOIRE;0710080B;LYCEE PROFESSIONNEL ALEXANDRE DUMAINE LYCEE DES METIERS;71270;MACON;public;LP;;381.0;381.0;;85.0;85.0;;27.0
2022-2023;DIJON;071;SAONE-ET-LOIRE;0711137A;LYCEE GENERAL ET TECHNOLOGIQUE CAMILLE CLAUDEL;71176;DIGOIN;public;LEGT;491.0;;491.0;102.2;;102.2;29.4;
2022-2023;DIJON;071;SAONE-ET-LOIRE;0711249X;LYCEE POLYVALENT PRIVE FREDERIC OZANAM;71270;MACON;privé sous contrat;LPO;463.0;41.0;504.0;122.9;107.6;121.6;28.6;27.1
2022-2023;DIJON;071;SAONE-ET-LOIRE;0711494N;LYCEE POLYVALENT PRIVE SAINT LAZARE;71014;AUTUN;privé sous contrat;LPO;33.0;128.0;161.0;100.4;94.3;95.5;23.9;22.3
2022-2023;NANTES;072;SARTHE;0720003M;LYCEE PROFESSIONNEL CLAUDE CHAPPE LYCEE DES METIERS DE LA MAINTENANCE DE L ELECTROTECHNIQUE ET DES STRUCTURES METALLIQUES;72008;ARNAGE;public;LP;;234.0;234.0;;78.5;78.5;;24.0
2022-2023;NANTES;072;SARTHE;0720012X;LYCEE GENERAL ET TECHNOLOGIQUE RACAN;72071;MONTVAL SUR LOIR;public;LEGT;442.0;;442.0;104.6;;104.6;33.3;
2022-2023;NANTES;072;SARTHE;0720027N;LYCEE POLYVALENT PERSEIGNE;72180;MAMERS;public;LPO;254.0;207.0;461.0;98.3;83.1;91.5;30.1;21.2
2022-2023;NANTES;072;SARTHE;0720837U;LYCEE GENERAL ET TECHNOLOGIQUE PRIVE NOTRE DAME;72181;LE MANS;privé sous contrat;LEGT;1140.0;;1140.0;125.0;;125.0;28.0;
2022-2023;GRENOBLE;073;SAVOIE;0730006K;LYCEE PROFESSIONNEL LE GRAND ARC;73011;ALBERTVILLE;public;LP;;330.0;330.0;;89.0;89.0;;27.6
2022-2023;GRENOBLE;073;SAVOIE;0730013T;LYCEE GENERAL VAUGELAS;73065;CHAMBERY;public;LEGT;982.0;;982.0;132.3;;132.3;34.6;
2022-2023;GRENOBLE;073;SAVOIE;0730772T;LYCEE PROFESSIONNEL PRIVE LE MARGERIAZ;73029;BARBERAZ;privé sous contrat;LP;;171.0;171.0;;105.8;105.8;;24.6
2022-2023;GRENOBLE;073;SAVOIE;0731043M;LYCEE PROFESSIONNEL LA CARDINIERE LYCEE DES METIERS DU COMMERCE DE LA GESTION ADMINISTRATIVE LOGISTIQUE ET TRANSPORT;73065;CHAMBERY;public;LP;;260.0;260.0;;86.4;86.4;;23.7
2022-2023;GRENOBLE;073;SAVOIE;0731248K;LYCEE POLYVALENT L ARMAND;73065;CHAMBERY;public;LPO;997.0;352.0;1349.0;119.7;89.9;111.9;34.7;25.6
2022-2023;GRENOBLE;073;SAVOIE;0731392S;LYCEE GENERAL ET TECHNOLOGIQUE DU GRANIER;73213;LA RAVOIRE;public;LEGT;1290.0;;1290.0;122.1;;122.1;33.0;
2022-2023;GRENOBLE;074;HAUTE SAVOIE;0740005D;LYCEE GENERAL ET TECHNOLOGIQUE GABRIEL FAURE;74010;ANNECY;public;LEGT;1593.0;;1593.0;120.8;;120.8;34.5;
2022-2023;GRENOBLE;074;HAUTE SAVOIE;0740046Y;LYCEE GENERAL ET TECHNOLOGIQUE LA VERSOIE;74281;THONON LES BAINS;public;LEGT;1580.0;;1580.0;113.9;;113.9;33.3;
2022-2023;GRENOBLE;074;HAUTE SAVOIE;0740152N;LYCEE PROFESSIONNEL PRIVE CECAM;74241;SAINT JEOIRE;privé sous contrat;LP;;126.0;126.0;;108.8;108.8;;28.6
2022-2023;GRENOBLE;074;HAUTE SAVOIE;0741164N;LYCEE PROFESSIONNEL TOM MOREL LYCEE DES METIERS DE L ACCUEIL LA VENTE ET LA GESTION;74010;ANNECY;public;LP;;407.0;407.0;;83.5;83.5;;27.7
2022-2023;GRENOBLE;074;HAUTE SAVOIE;0741286W;LYCEE PROFESSIONNEL PRIVE SAINTE FAMILLE LYCEE DES METIERS DE LA COMPTABILITE ET DE LA GESTION;74224;LA ROCHE SUR FORON;privé sous contrat;LP;;154.0;154.0;;112.3;112.3;;27.4
2022-2023;GRENOBLE;074;HAUTE SAVOIE;0741307U;LYCEE TECHNOLOGIQUE PRIVE JEANNE D ARC;74281;THONON LES BAINS;privé sous contrat;LEGT;136.0;;136.0;117.3;;117.3;30.1;
2022-2023;GRENOBLE;074;HAUTE SAVOIE;0741669M;LYCEE POLYVALENT RENE FRISON ROCHE;74056;CHAMONIX MONT BLANC;public;LPO;348.0;103.0;451.0;126.8;103.4;121.5;30.9;33.3
2022-2023;PARIS;075;PARIS;0750330B;LYCEE TECHNOLOGIQUE PRIVE ECOLE TECHNIQUE SUPERIEURE DU LABORATOIRE;75113;PARIS 13E ARRONDISSEMENT;privé sous contrat;LEGT;91.0;;91.0;134.9;;134.9;28.0;
2022-2023;PARIS;075;PARIS;0750553U;LYCEE PROFESSIONEL GASTON BACHELARD;75113;PARIS 13E ARRONDISSEMENT;public;LP;;190.0;190.0;;84.4;84.4;;25.6
2022-2023;PARIS;075;PARIS;0750653C;LYCEE GENERAL ET TECHNOLOGIQUE SOPHIE GERMAIN;75104;PARIS 4E ARRONDISSEMENT;public;LEGT;826.0;;826.0;134.3;;134.3;39.5;
2022-2023;PARIS;075;PARIS;0750674A;LYCEE TECHNOLOGIQUE JULES SIEGFRIED;75110;PARIS 10E ARRONDISSEMENT;public;LEGT;175.0;;175.0;88.6;;88.6;29.1;
2022-2023;PARIS;075;PARIS;0750683K;LYCEE GENERAL CLAUDE MONET;75113;PARIS 13E ARRONDISSEMENT;public;LEGT;1009.0;;1009.0;126.4;;126.4;40.5;
2022-2023;PARIS;075;PARIS;0750684L;LYCEE GENERAL GABRIEL FAURE;75113;PARIS 13E ARRONDISSEMENT;public;LEGT;573.0;;573.0;118.6;;118.6;37.0;
2022-2023;PARIS;075;PARIS;0750699C;LYCEE GENERAL ET TECHNOLOGIQUE JANSON DE SAILLY;75116;PARIS 16E ARRONDISSEMENT;public;LEGT;1086.0;;1086.0;133.5;;133.5;35.9;
2022-2023;PARIS;075;PARIS;0750700D;LYCEE GENERAL ET TECHNOLOGIQUE JEAN BAPTISTE SAY;75116;PARIS 16E ARRONDISSEMENT;public;LEGT;818.0;;818.0;142.0;;142.0;33.9;
2022-2023;PARIS;075;PARIS;0750715V;LYCEE GENERAL ET TECHNOLOGIQUE MAURICE RAVEL;75120;PARIS 20E ARRONDISSEMENT;public;LEGT;1159.0;;1159.0;120.3;;120.3;40.2;
2022-2023;PARIS;075;PARIS;0750775K;LYCEE PROFESSIONNEL GUSTAVE FERRIE;75110;PARIS 10E ARRONDISSEMENT;public;LP;;317.0;317.0;;87.8;87.8;;27.5
2022-2023;PARIS;075;PARIS;0750784V;LYCEE PROFESSIONNEL METIERS DE L AMEUBLEMENT;75112;PARIS 12E ARRONDISSEMENT;public;LP;;106.0;106.0;;122.6;122.6;;38.2
2022-2023;PARIS;075;PARIS;0750787Y;LYCEE PROFESSIONNEL CORVISART ARTS GRAPHIQUES;75113;PARIS 13E ARRONDISSEMENT;public;LP;;326.0;326.0;;105.9;105.9;;35.8
2022-2023;PARIS;075;PARIS;0750796H;LYCEE PROFESSIONNEL OCTAVE FEUILET LYCEE DES METIERS DE LA MODE;75116;PARIS 16E ARRONDISSEMENT;public;LP;;110.0;110.0;;107.9;107.9;;35.7
2022-2023;PARIS;075;PARIS;0750802P;LYCEE PROFESSIONNEL HECTOR GUIMARD LYCEE DES METIERS DU BATIMENT DE L ARTISANAT ET DU PATRIMOINE BATI;75119;PARIS 19E ARRONDISSEMENT;public;LP;;346.0;346.0;;82.9;82.9;;25.6
2022-2023;PARIS;075;PARIS;0751708Z;LYCEE POLYVALENT LOUIS ARMAND;75115;PARIS 15E ARRONDISSEMENT;public;LPO;370.0;269.0;639.0;100.8;88.7;95.7;32.5;26.2
2022-2023;PARIS;075;PARIS;0752846L;LYCEE PROFESSIONNEL ERIK SATIE;75114;PARIS 14E ARRONDISSEMENT;public;LP;;220.0;220.0;;82.8;82.8;;19.5
2022-2023;PARIS;075;PARIS;0753824Z;LYCEE GENERAL PRIVE MASSILLON;75104;PARIS 4E ARRONDISSEMENT;privé sous contrat;LEGT;443.0;;443.0;146.4;;146.4;16.2;
2022-2023;PARIS;075;PARIS;0753840S;ENSEIGNEMENT PRIVE STANISLAS (ECOLE SECONDAIRE PRIVEE);75106;PARIS 6E ARRONDISSEMENT;privé sous contrat;LEGT;876.0;;876.0;147.8;;147.8;15.8;
2022-2023;PARIS;075;PARIS;0753898E;ENSEMBLE SCOLAIRE EUGENE NAPOLEON SAINT PIERRE FOURIER;75112;PARIS 12E ARRONDISSEMENT;privé sous contrat;LEGT;496.0;;496.0;130.3;;130.3;26.1;
2022-2023;PARIS;075;PARIS;0753902J;LYCEE GENERAL PRIVE NOTRE DAME DE FRANCE;75113;PARIS 13E ARRONDISSEMENT;privé sous contrat;LEGT;225.0;;225.0;140.5;;140.5;19.2;
2022-2023;PARIS;075;PARIS;0753935V;LYCEE GENERAL PRIVE GEORGES LEVEN;75112;PARIS 12E ARRONDISSEMENT;privé sous contrat;LEGT;275.0;;275.0;129.0;;129.0;29.9;
2022-2023;PARIS;075;PARIS;0753946G;ETABLISSEMENT PRIVE NOTRE DAME DES OISEAUX (ECOLE SECONDAIRE PRIVEE);75116;PARIS 16E ARRONDISSEMENT;privé sous contrat;LEGT;468.0;;468.0;144.9;;144.9;17.3;
2022-2023;PARIS;075;PARIS;0754016H;LYCEE POLYVALENT PRIVE L INITIATIVE;75119;PARIS 19E ARRONDISSEMENT;privé sous contrat;LPO;89.0;241.0;330.0;131.5;129.2;129.8;28.8;28.9
