2022-2023;NORMANDIE;050;MANCHE;0502009M;LYCEE PROFESSIONNEL THOMAS PESQUET LYCEE DES METIERS;50147;COUTANCES;public;LP;;556.0;556.0;;90.0;90.0;;25.0
2022-2023;REIMS;051;MARNE;0510032H;LYCEE GENERAL ET TECHNOLOGIQUE JEAN JAURES;51454;REIMS;public;LEGT;996.0;;996.0;125.8;;125.8;34.8;
2022-2023;REIMS;051;MARNE;0510036M;LYCEE PROFESSIONNEL GUSTAVE EIFFEL LYCEE DES METIERS DE L AUTOMOBILE DE L HOTELLERIE RESTAURATION ET DE L ALIMENTATION;51454;REIMS;public;LP;;514.0;514.0;;81.9;81.9;;26.6
2022-2023;REIMS;051;MARNE;0510053F;LYCEE POLYVALENT LA FONTAINE DU VE;51535;SEZANNE;public;LPO;437.0;252.0;689.0;98.0;78.1;90.7;30.4;23.2
2022-2023;REIMS;051;MARNE;0510068X;LYCEE POLYVALENT EUROPEEN STEPHANE HESSEL LYCEE DES METIERS INDUSTRIELS ET TERTIAIRES DU VIGNOBLE;51230;EPERNAY;public;LPO;1374.0;390.0;1764.0;107.1;82.5;101.7;31.9;22.8
2022-2023;REIMS;051;MARNE;0511430C;LYCEE PROFESSIONNEL JOLIOT CURIE LYCEE DES METIERS DE LA SECURITE DE LA RELATION CLIENT ET DES SERVICES ADMINISTRATIFS;51454;REIMS;public;LP;;434.0;434.0;;78.2;78.2;;23.7
2022-2023;REIMS;051;MARNE;0511565Z;LYCEE POLYVALENT FRANCOIS ARAGO LYCEE DES METIERS DE L EFFICACITE ENERGETIQUE DU BATIMENT ET DES TRAVAUX PUBLICS;51454;REIMS;public;LPO;328.0;180.0;508.0;105.0;81.8;96.7;36.2;30.9
2022-2023;REIMS;051;MARNE;0511951U;LYCEE POLYVALENT JEAN TALON LYCEE DES METIERS DE LA GESTION DE LA COMPTABILITE ET DU COMMERCE;51108;CHALONS EN CHAMPAGNE;public;LPO;386.0;268.0;654.0;98.6;82.8;92.1;30.6;23.5
2022-2023;REIMS;052;HAUTE-MARNE;0520032C;LYCEE PROFESSIONNEL EMILE BAUDOT LYCEE DES METIERS DE LA SECURITE;52550;WASSY;public;LP;;146.0;146.0;;85.4;85.4;;24.0
2022-2023;REIMS;052;HAUTE-MARNE;0520679F;LYCEE GENERAL ET TECHNOLOGIQUE PRIVE ESTIC;52448;SAINT DIZIER;privé sous contrat;LEGT;342.0;;342.0;114.2;;114.2;29.1;
2022-2023;REIMS;052;HAUTE-MARNE;0520685M;LYCEE GENERAL ET TECHNOLOGIQUE PRIVE OUDINOT;52121;CHAUMONT;privé sous contrat;LEGT;195.0;;195.0;112.1;;112.1;25.0;
2022-2023;REIMS;052;HAUTE-MARNE;0520795G;LYCEE PROFESSIONNEL EDME BOUCHARDON;52121;CHAUMONT;public;LP;;300.0;300.0;;83.7;83.7;;24.4
2022-2023;REIMS;052;HAUTE-MARNE;0521032P;LYCEE POLYVALENT CHARLES DE GAULLE LYCEE DES METIERS DU DESIGN GRAPHIQUE ET DE LA TRANSFORMATION DU BOIS;52121;CHAUMONT;public;LPO;537.0;29.0;566.0;110.6;98.5;110.0;33.1;29.3
2022-2023;NANTES;053;MAYENNE;0530010Y;LYCEE GENERAL ET TECHNOLOGIQUE AMBROISE PARE;53130;LAVAL;public;LEGT;1055.0;;1055.0;111.5;;111.5;33.2;
2022-2023;NANTES;053;MAYENNE;0530011Z;LYCEE GENERAL ET TECHNOLOGIQUE DOUANIER ROUSSEAU;53130;LAVAL;public;LEGT;1001.0;;1001.0;112.8;;112.8;35.6;
2022-2023;NANTES;053;MAYENNE;0530040F;LYCEE PROFESSIONNEL PIERRE ET MARIE CURIE;53062;CHATEAU GONTIER SUR MAYENNE;public;LP;;197.0;197.0;;87.4;87.4;;24.3
2022-2023;NANTES;053;MAYENNE;0530048P;LYCEE GENERAL ET TECHNOLOGIQUE PRIVE IMMACULEE CONCEPTION;53130;LAVAL;privé sous contrat;LEGT;880.0;;880.0;124.3;;124.3;29.0;
2022-2023;NANCY-METZ;054;MEURTHE-ET-MOSELLE;0540015Y;LYCEE PROFESSIONNEL ENTRE MEURTHE ET SANON LYCEE DES METIERS ENTRE MEURTHE ET SANON;54159;DOMBASLE SUR MEURTHE;public;LP;;435.0;435.0;;82.8;82.8;;24.2
2022-2023;NANCY-METZ;054;MEURTHE-ET-MOSELLE;0540034U;LYCEE GENERAL ET TECHNOLOGIQUE ERNEST BICHAT;54329;LUNEVILLE;public;LEGT;937.0;;937.0;109.1;;109.1;33.5;
2022-2023;NANCY-METZ;054;MEURTHE-ET-MOSELLE;0540041B;LYCEE GENERAL ET TECHNOLOGIQUE GEORGES DE LA TOUR;54395;NANCY;public;LEGT;340.0;;340.0;102.4;;102.4;34.0;
2022-2023;NANCY-METZ;054;MEURTHE-ET-MOSELLE;0540060X;LYCEE PROFESSIONNEL LA TOURNELLE;54432;PONT SAINT VINCENT;public;LP;;212.0;212.0;;80.1;80.1;;22.8
2022-2023;NANCY-METZ;054;MEURTHE-ET-MOSELLE;0540066D;LYCEE GENERAL ET TECHNOLOGIQUE LOUIS MAJORELLE;54528;TOUL;public;LEGT;908.0;;908.0;112.2;;112.2;33.0;
2022-2023;NANCY-METZ;054;MEURTHE-ET-MOSELLE;0540086A;LYCEE PROFESSIONNEL JEAN MORETTE;54295;LANDRES;public;LP;;312.0;312.0;;85.2;85.2;;23.3
2022-2023;NANCY-METZ;054;MEURTHE-ET-MOSELLE;0541318P;LYCEE GENERAL PRIVE NOTRE DAME SAINT SIGISBERT;54395;NANCY;privé sous contrat;LEGT;480.0;;480.0;136.5;;136.5;26.4;
2022-2023;NANCY-METZ;054;MEURTHE-ET-MOSELLE;0541319R;LYCEE GENERAL PRIVE SAINT DOMINIQUE;54395;NANCY;privé sous contrat;LEGT;129.0;;129.0;125.1;;125.1;27.1;
2022-2023;NANCY-METZ;054;MEURTHE-ET-MOSELLE;0541998D;LYCEE PROFESSIONNEL PRIVE CHARLES DE FOUCAULD;54395;NANCY;privé sous contrat;LP;;8.0;8.0;;88.5;88.5;;29.6
2022-2023;NANCY-METZ;054;MEURTHE-ET-MOSELLE;0542293Z;LYCEE POLYVALENT JACQUES MARIE BOUTET DE MONVEL LYCEE DES METIERS D ART ET DE LA MAITRISE DE L ENERGIE ELECTRIQUE;54329;LUNEVILLE;public;LPO;174.0;176.0;350.0;112.4;83.6;97.9;33.3;27.5
2022-2023;NANCY-METZ;054;MEURTHE-ET-MOSELLE;0542448T;LYCEE TECHNOLOGIQUE CLAUDE DAUNOT;54395;NANCY;privé sous contrat;LEGT;30.0;;30.0;123.7;;123.7;25.1;
2022-2023;NANCY-METZ;055;MEUSE;0550003E;LYCEE PROFESSIONNEL EMILE ZOLA;55029;BAR LE DUC;public;LP;;285.0;285.0;;80.7;80.7;;25.5
2022-2023;NANCY-METZ;055;MEUSE;0550008K;LYCEE POLYVALENT HENRI VOGT;55122;COMMERCY;public;LPO;551.0;190.0;741.0;102.3;81.4;96.9;32.1;21.8
2022-2023;NANCY-METZ;055;MEUSE;0550047C;LYCEE GENERAL ET TECHNOLOGIQUE PRIVE SAINT LOUIS;55029;BAR LE DUC;privé sous contrat;LEGT;226.0;;226.0;120.4;;120.4;28.7;
2022-2023;NANCY-METZ;055;MEUSE;0550049E;LYCEE GENERAL ET TECHNOLOGIQUE PRIVE SAINTE ANNE;55545;VERDUN;privé sous contrat;LEGT;181.0;;181.0;116.9;;116.9;31.1;
2022-2023;NANCY-METZ;055;MEUSE;0550072E;LYCEE POLYVALENT ALFRED KASTLER;55502;STENAY;public;LPO;245.0;93.0;338.0;98.1;76.6;92.2;30.6;21.1
2022-2023;NANCY-METZ;055;MEUSE;0551032Y;LYCEE PROFESSIONNEL PRIVE SAINTE JEANNE D ARC;55122;COMMERCY;privé sous contrat;LP;;133.0;133.0;;97.6;97.6;;27.3
2022-2023;RENNES;056;MORBIHAN;0560027A;LYCEE PROFESSIONNEL MARIE LE FRANC LYCEE DES METIERS DE LA VENTE LYCEE DES METIERS DES SERVICES A LA PERSONNE;56121;LORIENT;public;LPO;77.0;582.0;659.0;95.5;89.6;90.3;28.5;26.5
2022-2023;RENNES;056;MORBIHAN;0560038M;LYCEE GENERAL ET TECHNOLOGIQUE JOSEPH LOTH;56178;PONTIVY;public;LEGT;827.0;;827.0;105.6;;105.6;33.3;
2022-2023;RENNES;056;MORBIHAN;0560117Y;LYCEE GENERAL ET TECHNOLOGIQUE PRIVE SAINT PAUL;56260;VANNES;privé sous contrat;LEGT;1594.0;;1594.0;126.8;;126.8;28.3;
2022-2023;RENNES;056;MORBIHAN;0560119A;LYCEE POLYVALENT PRIVE SAINTE ANNE SAINT LOUIS;56263;SAINTE ANNE D AURAY;privé sous contrat;LPO;624.0;136.0;760.0;122.3;102.4;118.7;29.4;22.5
2022-2023;RENNES;056;MORBIHAN;0560180S;LYCEE POLYVALENT PRIVE NOTRE DAME DE LA PAIX;56162;PLOEMEUR;privé sous contrat;LP;;352.0;352.0;;99.6;99.6;;28.5
2022-2023;RENNES;056;MORBIHAN;0560197K;LYCEE PROFESSIONNEL PRIVE SAINT MICHEL;56182;PRIZIAC;privé sous contrat;LP;;182.0;182.0;;99.9;99.9;;25.4
2022-2023;RENNES;056;MORBIHAN;0561641E;LYCEE POLYV MARCELLIN BERTHELOT LYCEE DES METIERS DES MATERIAUX PLASTIQUES ET COMPOSITES ET DES OUTILLAGES;56184;QUESTEMBERT;public;LPO;435.0;77.0;512.0;106.4;94.9;104.7;30.5;29.3
2022-2023;NANCY-METZ;057;MOSELLE;0570029X;LYCEE GENERAL ET TECHNOLOGIQUE JEAN MOULIN;57227;FORBACH;public;LEGT;550.0;;550.0;87.9;;87.9;34.8;
2022-2023;NANCY-METZ;057;MOSELLE;0570054Z;LYCEE GENERAL ET TECHNOLOGIQUE FABERT;57463;METZ;public;LEGT;1118.0;;1118.0;127.1;;127.1;35.5;
2022-2023;NANCY-METZ;057;MOSELLE;0570061G;LYCEE PROFESSIONNEL ALAIN FOURNIER LYCEE DES METIERS DU SANITAIRE ET DU SOCIAL;57463;METZ;public;LP;;429.0;429.0;;83.0;83.0;;25.8
2022-2023;NANCY-METZ;057;MOSELLE;0570210U;LYCEE TECHNOLOGIQUE PRIVE NOTRE DAME;57534;PELTRE;privé sous contrat;LEGT;68.0;;68.0;113.0;;113.0;26.2;
2022-2023;NANCY-METZ;057;MOSELLE;0570311D;LYCEE GENERAL ET TECHNOLOGIQUE PRIVE DE LA SALLE;57463;METZ;privé sous contrat;LEGT;537.0;;537.0;131.3;;131.3;26.6;
2022-2023;NANCY-METZ;057;MOSELLE;0572027U;LYCEE POLYVALENT ROSA PARKS;57672;THIONVILLE;public;LPO;970.0;460.0;1430.0;95.9;83.6;92.0;29.2;23.9
2022-2023;NANCY-METZ;057;MOSELLE;0572590F;LYCEE POLYVALENT GUSTAVE EIFFEL LYCEE DES METIERS;57663;TALANGE;public;LPO;77.0;335.0;412.0;95.6;84.6;86.7;28.9;24.1
2022-2023;NANCY-METZ;057;MOSELLE;0573080N;LYCEE PROFESSIONNEL HURLEVENT;57058;BEHREN LES FORBACH;public;LP;;178.0;178.0;;74.4;74.4;;21.4
2022-2023;NANCY-METZ;057;MOSELLE;0573281G;LYCEE GENERAL ET TECHNOLOGIQUE DE LA COMMUNICATION;57463;METZ;public;LEGT;1048.0;;1048.0;113.2;;113.2;36.3;
2022-2023;NANCY-METZ;057;MOSELLE;0573326F;LYCEE POLYVALENT LOUIS CASIMIR TEYSSIER;57089;BITCHE;public;LPO;447.0;94.0;541.0;105.3;80.7;101.0;31.4;22.5
2022-2023;NANCY-METZ;057;MOSELLE;0573770N;ENSEMBLE SCOLAIRE ST ETIENNE;57463;METZ;privé sous contrat;LEGT;60.0;;60.0;118.1;;118.1;24.2;
2022-2023;DIJON;058;NIEVRE;0580014A;LYCEE POLYVALENT PIERRE GILLES DE GENNES LYCEE DES METIERS;58086;COSNE COURS SUR LOIRE;public;LPO;394.0;211.0;605.0;110.7;88.7;103.0;31.8;23.2
2022-2023;DIJON;058;NIEVRE;0580020G;LYCEE PROFESSIONNEL PIERRE BEREGOVOY;58117;FOURCHAMBAULT;public;LP;;304.0;304.0;;94.3;94.3;;26.9
2022-2023;DIJON;058;NIEVRE;0580753D;LYCEE GENERAL ET TECHNOLOGIQUE ALAIN COLAS;58194;NEVERS;public;LEGT;593.0;;593.0;114.2;;114.2;32.2;
2022-2023;LILLE;059;NORD;0590011S;LYCEE POLYVALENT GUSTAVE EIFFEL LYCEE DES METIERS;59017;ARMENTIERES;public;LPO;799.0;202.0;1001.0;116.4;87.8;110.7;35.6;27.0
2022-2023;LILLE;059;NORD;0590034S;LYCEE GENERAL ET TECHNOLOGIQUE PAUL DUEZ;59122;CAMBRAI;public;LEGT;1406.0;;1406.0;101.8;;101.8;33.4;
2022-2023;LILLE;059;NORD;0590035T;LYCEE GENERAL ET TECHNOLOGIQUE FENELON;59122;CAMBRAI;public;LEGT;710.0;;710.0;106.9;;106.9;33.4;
2022-2023;LILLE;059;NORD;0590042A;LYCEE POLYVALENT CAMILLE DESMOULINS;59136;LE CATEAU CAMBRESIS;public;LPO;255.0;191.0;446.0;88.8;72.0;81.6;27.8;20.9
2022-2023;LILLE;059;NORD;0590064Z;LYCEE GENERAL ET TECHNOLOGIQUE JEAN BAPTISTE COROT;59178;DOUAI;public;LEGT;921.0;;921.0;101.0;;101.0;34.5;
2022-2023;LILLE;059;NORD;0590065A;LYCEE GENERAL ET TECHNOLOGIQUE EDMOND LABBE;59178;DOUAI;public;LEGT;565.0;;565.0;88.7;;88.7;29.4;
2022-2023;LILLE;059;NORD;0590086Y;LYCEE GENERAL ET TECHNOLOGIQUE MARGUERITE DE FLANDRE;59266;GONDECOURT;public;LEGT;1355.0;;1355.0;125.5;;125.5;34.5;
2022-2023;LILLE;059;NORD;0590101P;LYCEE GENERAL ET TECHNOLOGIQUE DES FLANDRES;59295;HAZEBROUCK;public;LEGT;1173.0;;1173.0;114.6;;114.6;33.3;
2022-2023;LILLE;059;NORD;0590102R;LYCEE PROFESSIONNEL DES MONTS DE FLANDRE;59295;HAZEBROUCK;public;LP;;540.0;540.0;;83.5;83.5;;24.5
2022-2023;LILLE;059;NORD;0590168M;LYCEE POLYVALENT EUGENE THOMAS;59481;LE QUESNOY;public;LPO;597.0;125.0;722.0;118.6;85.6;112.9;34.9;24.6
2022-2023;LILLE;059;NORD;0590181B;LYCEE GENERAL ET TECHNOLOGIQUE MAXENCE VAN DER MEERSCH;59512;ROUBAIX;public;LEGT;504.0;;504.0;92.3;;92.3;34.5;
2022-2023;LILLE;059;NORD;0590185F;LPO JEAN MOULIN LYCEE DES METIERS DE LA SECURITE ET DE LA PREVENTION DES SERVICES ADMINISTRATIFS ET DE LA RELATION AUX CLIENTS;59512;ROUBAIX;public;LPO;484.0;320.0;804.0;72.2;73.7;72.8;21.4;24.3
2022-2023;LILLE;059;NORD;0590215N;LYCEE GENERAL ET TECHNOLOGIQUE SEVIGNE;59599;TOURCOING;public;LEGT;153.0;;153.0;75.2;;75.2;23.7;
2022-2023;LILLE;059;NORD;0590258K;LYCEE GENERAL ET TECHNOLOGIQUE GASTON BERGER;59350;LILLE;public;LEGT;329.0;;329.0;86.0;;86.0;29.6;
2022-2023;LILLE;059;NORD;0590263R;LYCEE PROFESSIONNEL FERNAND LEGER;59155;COUDEKERQUE BRANCHE;public;LP;;296.0;296.0;;78.6;78.6;;23.1
2022-2023;LILLE;059;NORD;0590266U;LYCEE PROFESSIONNEL CESAR BAGGIO;59350;LILLE;public;LP;;409.0;409.0;;79.9;79.9;;27.4
2022-2023;LILLE;059;NORD;0592610S;LYCEE PROFESSIONNEL PIERRE JOSEPH LAURENT;59008;ANICHE;public;LP;;531.0;531.0;;74.9;74.9;;21.7
2022-2023;LILLE;059;NORD;0592935V;LYCEE GENERAL PRIVE LA CROIX BLANCHE;59090;BONDUES;privé sous contrat;LEGT;573.0;;573.0;137.2;;137.2;25.4;
2022-2023;LILLE;059;NORD;0592966D;LYCEE POLYVALENT PRIVE EIC JEHANNE D ARC;59599;TOURCOING;privé sous contrat;LPO;119.0;354.0;473.0;108.1;98.4;100.8;28.8;26.9
2022-2023;LILLE;059;NORD;0592973L;LYCEE PROFESSIONNEL PRIVE SAINT FRANCOIS D ASSISE;59512;ROUBAIX;privé sous contrat;LP;;347.0;347.0;;91.5;91.5;;24.5
2022-2023;LILLE;059;NORD;0593058D;LYCEE POLYVALENT PRIVE VAUBAN LYCEE DES METIERS;59183;DUNKERQUE;privé sous contrat;LPO;181.0;330.0;511.0;102.1;94.2;97.0;26.1;23.2
2022-2023;LILLE;059;NORD;0593071T;LYCEE POLYVALENT PRIVE DEFOREST DE LEWARDE;59178;DOUAI;privé sous contrat;LPO;119.0;248.0;367.0;103.0;96.9;98.9;29.4;24.6
2022-2023;LILLE;059;NORD;0593078A;LYCEE POLYVALENT PRIVE FONDATION DEPOORTER LYCEE DES METIERS DE LA SANTE ET DU SOCIAL;59295;HAZEBROUCK;privé sous contrat;LPO;156.0;232.0;388.0;108.4;95.8;100.8;29.5;23.3
2022-2023;LILLE;059;NORD;0593114P;LYCEE GENERAL PRIVE SAINT PAUL;59350;LILLE;privé sous contrat;LEGT;1030.0;;1030.0;143.4;;143.4;21.8;
2022-2023;LILLE;059;NORD;0593117T;LYCEE POLYVALENT PRIVE LA SALLE;59350;LILLE;privé sous contrat;LPO;756.0;164.0;920.0;128.1;120.7;126.8;29.3;30.6
2022-2023;LILLE;059;NORD;0593138R;LYCEE GENERAL PRIVE SAINT MICHEL;59571;SOLESMES;privé sous contrat;LEGT;246.0;;246.0;121.1;;121.1;28.0;
2022-2023;LILLE;059;NORD;0594404S;LYCEE PROFESSIONNEL RENE CASSIN;59414;MONTIGNY EN OSTREVENT;public;LP;;194.0;194.0;;71.6;71.6;;20.0
2022-2023;LILLE;059;NORD;0595480L;LYCEE PROFESSIONNEL ILE JEANTY;59183;DUNKERQUE;public;LP;;306.0;306.0;;73.7;73.7;;20.6
2022-2023;LILLE;059;NORD;0595616J;LYCEE GENERAL ET TECHNOLOGIQUE DU NOORDOVER;59271;GRANDE SYNTHE;public;LEGT;786.0;;786.0;92.0;;92.0;30.8;
2022-2023;LILLE;059;NORD;0596281G;LYCEE GENERAL PRIVE DE GENECH;59258;GENECH;privé sous contrat;LEGT;806.0;;806.0;128.4;;128.4;25.8;
2022-2023;LILLE;059;NORD;0596854E;LYCEE POLYVALENT DU PAYS DE CONDE;59153;CONDE SUR L ESCAUT;public;LPO;662.0;597.0;1259.0;83.8;70.4;77.4;28.2;18.4
2022-2023;LILLE;059;NORD;0596957S;LYCEE PROFESSIONNEL AIME CESAIRE;59350;LILLE;public;LP;;509.0;509.0;;73.2;73.2;;22.0
2022-2023;LILLE;059;NORD;0597005U;LYCEE POLYVALENT DU VAL DE LYS;59212;ESTAIRES;public;LPO;469.0;169.0;638.0;103.3;83.3;98.0;32.8;25.2
2022-2023;AMIENS;060;OISE;0600001A;LYCEE GENERAL ET TECHNOLOGIQUE FELIX FAURE;60057;BEAUVAIS;public;LEGT;1219.0;;1219.0;112.3;;112.3;35.0;
2022-2023;AMIENS;060;OISE;0600004D;LYCEE PROFESSIONNEL LES JACOBINS;60057;BEAUVAIS;public;LP;;772.0;772.0;;86.3;86.3;;25.6
2022-2023;AMIENS;060;OISE;0600015R;LYCEE D ENSEIGNEMENT GENERAL ET TECHNOLOGIQUE MIREILLE GRENET;60159;COMPIEGNE;public;LEGT;1047.0;;1047.0;105.9;;105.9;33.4;
2022-2023;AMIENS;060;OISE;0600016S;LYCEE PROFESSIONNEL MIREILLE GRENET INDUSTRIEL LYCEE DES METIERS DE L INNOVATION ET DES SERVICES;60159;COMPIEGNE;public;LP;;426.0;426.0;;91.3;91.3;;27.0
2022-2023;AMIENS;060;OISE;0600048B;LYCEE PROFESSIONNEL DONATION DE ROTHSCHILD;60589;SAINT MAXIMIN;public;LP;;332.0;332.0;;87.6;87.6;;27.1
2022-2023;AMIENS;060;OISE;0600049C;LYCEE PROFESSIONNEL AMYOT D INVILLE LYCEE DES METIERS DU BTP DE LA VENTE ET DE LA COMMUNICATION GRAPHIQUE;60612;SENLIS;public;LP;;550.0;550.0;;90.5;90.5;;28.1
2022-2023;AMIENS;060;OISE;0601162M;LYCEE PROFESSIONNEL PRIVE ST VINCENT DE PAUL;60057;BEAUVAIS;privé sous contrat;LP;;233.0;233.0;;99.7;99.7;;25.7
2022-2023;AMIENS;060;OISE;0601700X;LYCEE GENERAL ET TECHNOLOGIQUE PRIVE SEVIGNE;60159;COMPIEGNE;privé sous contrat;LEGT;149.0;;149.0;124.0;;124.0;32.3;
2022-2023;AMIENS;060;OISE;0601703A;LYCEE GENERAL ET TECHNOLOGIQUE PRIVE LA MAISON FRANCAISE;60188;CUISE LA MOTTE;privé sous contrat;LEGT;29.0;;29.0;127.5;;127.5;29.0;
2022-2023;AMIENS;060;OISE;0601823F;LYCEE GENERAL ET TECHNOLOGIQUE FRANCOIS TRUFFAUT LYCEE DES METIERS DU TERTIAIRE DE LA SANTE ET DU SOCIAL;60057;BEAUVAIS;public;LEGT;1007.0;;1007.0;103.4;;103.4;30.2;
2022-2023;AMIENS;060;OISE;0601824G;LYCEE GENERAL ET TECHNOLOGIQUE JEANNE HACHETTE;60057;BEAUVAIS;public;LEGT;1002.0;;1002.0;108.0;;108.0;33.2;
2022-2023;AMIENS;060;OISE;0601845E;LYCEE PROFESSIONNEL DE LA FORET LYCEE DES METIERS DES SERVICES AUX ENTREPRISES;60141;CHANTILLY;public;LP;;410.0;410.0;;86.2;86.2;;25.8
2022-2023;AMIENS;060;OISE;0601897L;LYCEE PROFESSIONNEL JULES VERNE LYCEE DES METIERS DU GENIE ELECTRIQUE ET DES SERVICES A LA PERSONNE;60286;GRANDVILLIERS;public;LPO;20.0;218.0;238.0;79.2;74.9;75.3;20.3;20.7
2022-2023;NORMANDIE;061;ORNE;0610002W;LYCEE POLYVALENT NAVARRE LECLERC;61001;ALENCON;public;LPO;793.0;294.0;1087.0;105.3;82.1;99.0;34.7;23.9
2022-2023;NORMANDIE;061;ORNE;0610021S;LYCEE POLYVALENT JEAN GUEHENNO LYCEE DES METIERS DES SERVICES DE L INDUSTRIE ET DU TERTIAIRE;61169;FLERS;public;LPO;590.0;219.0;809.0;97.9;76.6;92.2;33.5;21.5
2022-2023;NORMANDIE;061;ORNE;0610700E;LYCEE GENERAL PRIVE BIGNON;61293;MORTAGNE AU PERCHE;privé sous contrat;LEGT;110.0;;110.0;117.7;;117.7;29.7;
2022-2023;NORMANDIE;061;ORNE;0610702G;LYCEE GENERAL PRIVE MARIE IMMACULEE;61464;SEES;privé sous contrat;LEGT;90.0;;90.0;110.8;;110.8;25.9;
2022-2023;NORMANDIE;061;ORNE;0610721C;LYCEE PROFESSIONNEL PRIVE JEANNE D ARC;61006;ARGENTAN;privé sous contrat;LP;;156.0;156.0;;99.9;99.9;;23.5
2022-2023;LILLE;062;PAS-DE-CALAIS;0620018H;LYCEE PROFESSIONNEL FERNAND DEGRUGILLIER;62048;AUCHEL;public;LP;;305.0;305.0;;74.2;74.2;;21.2
2022-2023;LILLE;062;PAS-DE-CALAIS;0620030W;LYCEE PROFESSIONNEL PHILIPPE AUGUSTE;62080;BAPAUME;public;LP;;371.0;371.0;;81.3;81.3;;21.2
2022-2023;LILLE;062;PAS-DE-CALAIS;0620042J;LYCEE GENERAL ET TECHNOLOGIQUE ANDRE MALRAUX;62119;BETHUNE;public;LEGT;504.0;;504.0;101.4;;101.4;32.4;
2022-2023;LILLE;062;PAS-DE-CALAIS;0620056Z;LYCEE POLYVALENT CARNOT LYCEE DES METIERS DES SYSTEMES AUTOMATIQUES ET DE L ELECTRONIQUE COMMUNICANTE;62178;BRUAY LA BUISSIERE;public;LPO;1064.0;307.0;1371.0;95.1;76.3;90.9;31.6;22.6
2022-2023;LILLE;062;PAS-DE-CALAIS;0620062F;LYCEE GENERAL ET TECHNOLOGIQUE PIERRE DE COUBERTIN;62193;CALAIS;public;LEGT;892.0;;892.0;104.4;;104.4;33.3;
2022-2023;LILLE;062;PAS-DE-CALAIS;0620070P;LYCEE GENERAL ET TECHNOLOGIQUE DIDEROT;62215;CARVIN;public;LEGT;567.0;;567.0;97.2;;97.2;31.3;
2022-2023;LILLE;062;PAS-DE-CALAIS;0620110H;LYCEE PROFESSIONNEL AUGUSTE BEHAL LYCEE DES METIERS DE LA PERSONNE SANTE SOCIAL LYCEE DES METIERS DE CONSTRUCTION BOIS ET MATERIAUX;62498;LENS;public;LP;;514.0;514.0;;74.6;74.6;;22.8
2022-2023;LILLE;062;PAS-DE-CALAIS;0620190V;LYCEE PROFESSIONNEL HENRI DARRAS;62510;LIEVIN;public;LP;;274.0;274.0;;80.5;80.5;;25.6
2022-2023;LILLE;062;PAS-DE-CALAIS;0622106C;LYCEE GENERAL PRIVE SAINT VAAST SAINT DOMINIQUE;62119;BETHUNE;privé sous contrat;LEGT;529.0;;529.0;129.4;;129.4;25.9;
2022-2023;LILLE;062;PAS-DE-CALAIS;0622120T;LYCEE GENERAL PRIVE NOTRE DAME DE SION;62765;SAINT OMER;privé sous contrat;LEGT;303.0;;303.0;119.8;;119.8;28.5;
2022-2023;LILLE;062;PAS-DE-CALAIS;0622195Z;LYCEE PROFESSIONNEL PRIVE SAINTE MARIE;62364;FRUGES;privé sous contrat;LP;;142.0;142.0;;98.2;98.2;;23.7
2022-2023;LILLE;062;PAS-DE-CALAIS;0622198C;LPO PRIVE ET CAMPUS ST JOSEPH LYCEE DES METIERS ENERGIES NUMERIQUE ET AUTOMATION MANAGEMENT GESTION COMMUNICATION SANTE SOCIAL;62758;SAINT MARTIN BOULOGNE;privé sous contrat;LPO;503.0;257.0;760.0;108.0;96.0;104.0;27.3;23.4
2022-2023;LILLE;062;PAS-DE-CALAIS;0623864N;LYCEE PROFESSIONNEL MAXIMILIEN DE ROBESPIERRE;62498;LENS;public;LP;;555.0;555.0;;77.5;77.5;;24.0
2022-2023;LILLE;062;PAS-DE-CALAIS;0623915U;LYCEE GENERAL ET TECHNOLOGIQUE VOLTAIRE;62895;WINGLES;public;LEGT;991.0;;991.0;107.9;;107.9;33.4;
2022-2023;LILLE;062;PAS-DE-CALAIS;0623981R;LYCEE POLYVALENT VAUBAN;62014;AIRE SUR LA LYS;public;LPO;756.0;203.0;959.0;109.6;85.6;104.5;30.4;24.9
2022-2023;LILLE;062;PAS-DE-CALAIS;0624141P;LYCEE POLYVALENT LEONARD DE VINCI;62193;CALAIS;public;LPO;858.0;66.0;924.0;99.4;83.5;98.3;31.8;26.8
2022-2023;LILLE;062;PAS-DE-CALAIS;0624440P;LYCEE POLYVALENT D ARTOIS LYCEE DES METIERS DES SYSTEMES AUTOMATIQUES;62617;NOEUX LES MINES;public;LPO;570.0;347.0;917.0;97.0;76.2;89.1;31.7;22.8
2022-2023;CLERMONT-FERRAND;063;PUY-DE-DOME;0630034V;LYCEE GENERAL ET TECHNOLOGIQUE MURAT;63178;ISSOIRE;public;LEGT;971.0;;971.0;114.7;;114.7;34.8;
2022-2023;CLERMONT-FERRAND;063;PUY-DE-DOME;0630068G;LYCEE GENERAL ET TECHNOLOGIQUE MONTDORY;63430;THIERS;public;LEGT;669.0;;669.0;104.7;;104.7;33.8;
2022-2023;CLERMONT-FERRAND;063;PUY-DE-DOME;0631032E;LYCEE GENERAL PRIVE SAINT PIERRE;63125;COURPIERE;privé sous contrat;LEGT;103.0;;103.0;110.9;;110.9;26.1;
2022-2023;CLERMONT-FERRAND;063;PUY-DE-DOME;0631048X;LYCEE PROFESSIONNEL PRIVE RENE RAMBAUD COIFFURE;63113;CLERMONT FERRAND;privé sous contrat;LP;;86.0;86.0;;96.6;96.6;;23.5
2022-2023;CLERMONT-FERRAND;063;PUY-DE-DOME;0631074A;LYCEE GENERAL ET TECHNOLOGIQUE PRIVE FENELON LYCEE DES METIERS DE LA SANTE ET DU SOCIAL;63113;CLERMONT FERRAND;privé sous contrat;LEGT;393.0;;393.0;129.0;;129.0;27.1;
2022-2023;CLERMONT-FERRAND;063;PUY-DE-DOME;0631075B;LYCEE GENERAL ET TECHNOLOGIQUE PRIVE SAINT ALYRE;63113;CLERMONT FERRAND;privé sous contrat;LEGT;595.0;;595.0;130.2;;130.2;26.9;
2022-2023;CLERMONT-FERRAND;063;PUY-DE-DOME;0631847R;LYCEE GENERAL PRIVE MASSILLON;63113;CLERMONT FERRAND;privé sous contrat;LEGT;376.0;;376.0;142.7;;142.7;24.4;
2022-2023;CLERMONT-FERRAND;063;PUY-DE-DOME;0632091F;LYCEE PROFESSIONNEL GERGOVIE (A ABSORBE LES UAI 0630023H ET 0631409P EN 2022);63113;CLERMONT FERRAND;public;LP;;834.0;834.0;;87.3;87.3;;26.2
2022-2023;BORDEAUX;064;PYRENEES-ATLANTIQUES;0640026F;LYCEE PROFESSIONNEL LYCEE DES METIERS DE L HABITAT ET DE L INDUSTRIE;64237;GELOS;public;LP;;149.0;149.0;;88.4;88.4;;29.1
2022-2023;BORDEAUX;064;PYRENEES-ATLANTIQUES;0640057P;LYCEE POLYVALENT SAINT CRICQ;64445;PAU;public;LPO;1190.0;87.0;1277.0;120.2;96.4;118.6;34.6;31.0
2022-2023;BORDEAUX;064;PYRENEES-ATLANTIQUES;0640066Z;LYCEE PROFESSIONNEL RAMIRO ARRUE LYCEE DES METIERS COTE BASQUE;64483;SAINT JEAN DE LUZ;public;LP;;255.0;255.0;;96.1;96.1;;26.9
2022-2023;BORDEAUX;064;PYRENEES-ATLANTIQUES;0640079N;LYCEE PROFESSIONNEL PIERRE ET MARIE CURIE;64410;MOURENX;public;LP;;119.0;119.0;;89.4;89.4;;26.8
2022-2023;BORDEAUX;064;PYRENEES-ATLANTIQUES;0640130U;LYCEE GENERAL ET TECHNOLOGIQUE PRIVE IMMACULEE CONCEPTION BEAU FRENE;64445;PAU;privé sous contrat;LEGT;573.0;;573.0;130.3;;130.3;27.6;
2022-2023;BORDEAUX;064;PYRENEES-ATLANTIQUES;0640134Y;LYCEE GENERAL ET TECHNOLOGIQUE PRIVE SAINT THOMAS D AQUIN;64483;SAINT JEAN DE LUZ;privé sous contrat;LEGT;617.0;;617.0;121.0;;121.0;28.3;
2022-2023;BORDEAUX;064;PYRENEES-ATLANTIQUES;0641663K;LYCEE PROFESSIONNEL PRIVE STELLA MARIS LYCEE DES METIERS DES SCIENCES BIOTECHNOLOGIQUES PARAMEDICALES ET SOCIALES;64024;ANGLET;privé sous contrat;LP;;183.0;183.0;;102.3;102.3;;26.2
2022-2023;BORDEAUX;064;PYRENEES-ATLANTIQUES;0641664L;LYCEE PROFESSIONNEL PRIVE IMMACULEE CONCEPTION BEAU FRENE LYCEE DES METIERS DE L INDUSTRIE DU NUMERIQUE ET DE LA TRANSITION ENERGETIQUE;64445;PAU;privé sous contrat;LP;;169.0;169.0;;106.0;106.0;;27.5
2022-2023;BORDEAUX;064;PYRENEES-ATLANTIQUES;0641665M;LYCEE PROFESSIONNEL PRIVE LE BEAU RAMEAU IGON;64270;IGON;privé sous contrat;LP;;116.0;116.0;;103.2;103.2;;23.3
2022-2023;BORDEAUX;064;PYRENEES-ATLANTIQUES;0641823J;LYCEE POLYVALENT BIARRITZ ATLANTIQUE LYCEE DES METIERS DE L HOTELLERIE ET DU TOURISME;64122;BIARRITZ;public;LPO;99.0;306.0;405.0;118.7;106.0;109.1;29.1;29.8
2022-2023;BORDEAUX;064;PYRENEES-ATLANTIQUES;0641844G;LYCEE POLYVALENT DE NAVARRE;64485;SAINT JEAN PIED DE PORT;public;LPO;257.0;116.0;373.0;110.5;95.8;105.9;30.7;27.1
2022-2023;BORDEAUX;064;PYRENEES-ATLANTIQUES;0641907A;LYCEE POLYVALENT PRIVE BERNAT ETXEPARE;64102;BAYONNE;privé sous contrat;LPO;377.0;50.0;427.0;126.0;108.5;124.0;29.6;31.2
2022-2023;TOULOUSE;065;HAUTES-PYRENEES;0650005C;LYCEE POLYVALENT VICTOR DURUY LYCEE DES METIERS DES SERVICES A LA PERSONNE ET DE L INDUSTRIE EN MONTAGNE;65059;BAGNERES DE BIGORRE;public;LPO;323.0;203.0;526.0;115.9;96.6;108.5;30.9;27.9
2022-2023;TOULOUSE;065;HAUTES-PYRENEES;0650025Z;LYCEE GENERAL THEOPHILE GAUTIER;65440;TARBES;public;LEGT;655.0;;655.0;117.3;;117.3;33.4;
2022-2023;TOULOUSE;065;HAUTES-PYRENEES;0650065T;LYCEE TECHNOLOGIQUE PRIVE PRADEAU LA SEDE SAINT PIERRE;65440;TARBES;privé sous contrat;LEGT;200.0;;200.0;115.2;;115.2;27.8;
2022-2023;MONTPELLIER;066;PYRENEES-ORIENTALES;0660924W;LYCEE POLYVALENT CHRISTIAN BOURQUIN;66008;ARGELES SUR MER;public;LPO;613.0;330.0;943.0;108.9;89.4;102.0;31.3;29.2
2022-2023;STRASBOURG;067;BAS-RHIN;0670002N;LYCEE GENERAL ET TECHNOLOGIQUE SCHURE;67021;BARR;public;LEGT;448.0;;448.0;115.3;;115.3;36.2;
2022-2023;STRASBOURG;067;BAS-RHIN;0670024M;LYCEE PROFESSIONNEL ANDRE SIEGFRIED LYCEE DES METIERS;67180;HAGUENAU;public;LP;;626.0;626.0;;84.3;84.3;;24.5
2022-2023;STRASBOURG;067;BAS-RHIN;0670041F;LYCEE GENERAL ET TECHNOLOGIQUE HENRI MECK;67300;MOLSHEIM;public;LEGT;1014.0;;1014.0;116.8;;116.8;36.2;
2022-2023;STRASBOURG;067;BAS-RHIN;0670043H;LYCEE PROFESSIONNEL CAMILLE SCHNEIDER;67300;MOLSHEIM;public;LP;;314.0;314.0;;85.3;85.3;;25.8
2022-2023;STRASBOURG;067;BAS-RHIN;0670057Y;LYCEE GENERAL ET TECHNOLOGIQUE GENERAL LECLERC;67437;SAVERNE;public;LEGT;720.0;;720.0;110.5;;110.5;33.5;
2022-2023;STRASBOURG;067;BAS-RHIN;0670058Z;LYCEE PROFESSIONNEL JULES VERNE LYCEE DES METIERS;67437;SAVERNE;public;LP;;360.0;360.0;;84.3;84.3;;25.1
2022-2023;STRASBOURG;067;BAS-RHIN;0670062D;LYCEE PROFESSIONNEL ARISTIDE BRIAND;67447;SCHILTIGHEIM;public;LP;;448.0;448.0;;76.5;76.5;;22.1
2022-2023;STRASBOURG;067;BAS-RHIN;0670085D;LYCEE POLYVALENT LOUIS COUFFIGNAL LYCEE DES METIERS;67482;STRASBOURG;public;LPO;547.0;419.0;966.0;104.4;82.4;94.9;36.9;28.9
2022-2023;STRASBOURG;067;BAS-RHIN;0671509B;LYCEE POLYVALENT HEINRICH NESSEL LYCEE DES METIERS;67180;HAGUENAU;public;LPO;703.0;327.0;1030.0;111.3;84.4;102.8;33.3;27.1
2022-2023;STRASBOURG;067;BAS-RHIN;0671832C;LYCEE POLYVALENT JEAN BAPTISTE SCHWILGUE;67462;SELESTAT;public;LPO;757.0;244.0;1001.0;111.2;88.4;105.7;32.6;26.6
2022-2023;STRASBOURG;067;BAS-RHIN;0672305S;LYCEE PROFESSIONNEL PRIVE INSTITUTION SAINTE CLOTILDE LYCEE DES METIERS;67482;STRASBOURG;privé sous contrat;LP;;288.0;288.0;;101.8;101.8;;29.7
2022-2023;STRASBOURG;067;BAS-RHIN;0672534R;LYCEE POLYVALENT HAUT BARR LYCEE DES METIERS;67437;SAVERNE;public;LPO;526.0;69.0;595.0;118.4;93.6;115.5;34.2;31.7
2022-2023;STRASBOURG;067;BAS-RHIN;0672614C;LYCEE POLYVALENT GEORGES IMBERT;67434;SARRE UNION;public;LPO;294.0;147.0;441.0;103.2;84.0;96.8;31.5;25.9
2022-2023;STRASBOURG;067;BAS-RHIN;0673083M;LYCEE PRIVE ECOLE LIBRE SAINTE ANNE;67482;STRASBOURG;privé sous contrat;LEGT;241.0;;241.0;119.1;;119.1;28.5;
2022-2023;STRASBOURG;068;HAUT-RHIN;0680010S;LYCEE POLYVALENT BLAISE PASCAL;68066;COLMAR;public;LPO;819.0;445.0;1264.0;106.6;81.3;97.7;34.3;23.9
